No.     Time           Source                Destination           Protocol Length Info
      1 0.000000000    172.26.23.10          142.250.82.70         TCP      106    [TCP segment of a reassembled PDU]

Frame 1: 106 bytes on wire (848 bits), 106 bytes captured (848 bits) on interface unknown, id 0
Ethernet II, Src: IntelCor_5a:74:ae (b0:35:9f:5a:74:ae), Dst: ComdaEnt_ff:94:00 (00:d0:03:ff:94:00)
Internet Protocol Version 4, Src: 172.26.23.10, Dst: 142.250.82.70
Transmission Control Protocol, Src Port: 37390, Dst Port: 443, Seq: 1, Ack: 1, Len: 40
Transport Layer Security

No.     Time           Source                Destination           Protocol Length Info
      2 0.000679000    172.26.23.10          142.250.82.70         TCP      1166   [TCP segment of a reassembled PDU]

Frame 2: 1166 bytes on wire (9328 bits), 1166 bytes captured (9328 bits) on interface unknown, id 0
Ethernet II, Src: IntelCor_5a:74:ae (b0:35:9f:5a:74:ae), Dst: ComdaEnt_ff:94:00 (00:d0:03:ff:94:00)
Internet Protocol Version 4, Src: 172.26.23.10, Dst: 142.250.82.70
Transmission Control Protocol, Src Port: 37390, Dst Port: 443, Seq: 41, Ack: 1, Len: 1100
Transport Layer Security

No.     Time           Source                Destination           Protocol Length Info
      3 0.002041000    172.26.23.10          142.250.82.70         TCP      1166   [TCP segment of a reassembled PDU]

Frame 3: 1166 bytes on wire (9328 bits), 1166 bytes captured (9328 bits) on interface unknown, id 0
Ethernet II, Src: IntelCor_5a:74:ae (b0:35:9f:5a:74:ae), Dst: ComdaEnt_ff:94:00 (00:d0:03:ff:94:00)
Internet Protocol Version 4, Src: 172.26.23.10, Dst: 142.250.82.70
Transmission Control Protocol, Src Port: 37390, Dst Port: 443, Seq: 1141, Ack: 1, Len: 1100
Transport Layer Security

No.     Time           Source                Destination           Protocol Length Info
      4 0.008382000    172.26.23.10          142.250.82.70         TCP      122    [TCP segment of a reassembled PDU]

Frame 4: 122 bytes on wire (976 bits), 122 bytes captured (976 bits) on interface unknown, id 0
Ethernet II, Src: IntelCor_5a:74:ae (b0:35:9f:5a:74:ae), Dst: ComdaEnt_ff:94:00 (00:d0:03:ff:94:00)
Internet Protocol Version 4, Src: 172.26.23.10, Dst: 142.250.82.70
Transmission Control Protocol, Src Port: 37390, Dst Port: 443, Seq: 2241, Ack: 1, Len: 56
Transport Layer Security

No.     Time           Source                Destination           Protocol Length Info
      5 0.008494000    172.26.23.10          142.250.82.70         TCP      1166   [TCP segment of a reassembled PDU]

Frame 5: 1166 bytes on wire (9328 bits), 1166 bytes captured (9328 bits) on interface unknown, id 0
Ethernet II, Src: IntelCor_5a:74:ae (b0:35:9f:5a:74:ae), Dst: ComdaEnt_ff:94:00 (00:d0:03:ff:94:00)
Internet Protocol Version 4, Src: 172.26.23.10, Dst: 142.250.82.70
Transmission Control Protocol, Src Port: 37390, Dst Port: 443, Seq: 2297, Ack: 1, Len: 1100
Transport Layer Security

No.     Time           Source                Destination           Protocol Length Info
      6 0.010132000    172.26.23.10          142.250.82.70         TCP      180    [TCP segment of a reassembled PDU]

Frame 6: 180 bytes on wire (1440 bits), 180 bytes captured (1440 bits) on interface unknown, id 0
Ethernet II, Src: IntelCor_5a:74:ae (b0:35:9f:5a:74:ae), Dst: ComdaEnt_ff:94:00 (00:d0:03:ff:94:00)
Internet Protocol Version 4, Src: 172.26.23.10, Dst: 142.250.82.70
Transmission Control Protocol, Src Port: 37390, Dst Port: 443, Seq: 3397, Ack: 1, Len: 114
Transport Layer Security

No.     Time           Source                Destination           Protocol Length Info
      7 0.010203000    142.250.82.70         172.26.23.10          SSLv2    417    Encrypted Data

Frame 7: 417 bytes on wire (3336 bits), 417 bytes captured (3336 bits) on interface unknown, id 0
Ethernet II, Src: ComdaEnt_ff:94:00 (00:d0:03:ff:94:00), Dst: IntelCor_5a:74:ae (b0:35:9f:5a:74:ae)
Internet Protocol Version 4, Src: 142.250.82.70, Dst: 172.26.23.10
Transmission Control Protocol, Src Port: 443, Dst Port: 37390, Seq: 1, Ack: 4294967180, Len: 351
Transport Layer Security

No.     Time           Source                Destination           Protocol Length Info
      8 0.016096000    172.26.23.10          142.250.82.70         TCP      1166   [TCP segment of a reassembled PDU]

Frame 8: 1166 bytes on wire (9328 bits), 1166 bytes captured (9328 bits) on interface unknown, id 0
Ethernet II, Src: IntelCor_5a:74:ae (b0:35:9f:5a:74:ae), Dst: ComdaEnt_ff:94:00 (00:d0:03:ff:94:00)
Internet Protocol Version 4, Src: 172.26.23.10, Dst: 142.250.82.70
Transmission Control Protocol, Src Port: 37390, Dst Port: 443, Seq: 3511, Ack: 352, Len: 1100
Transport Layer Security

No.     Time           Source                Destination           Protocol Length Info
      9 0.022321000    172.26.23.10          142.250.82.70         TCP      1166   [TCP segment of a reassembled PDU]

Frame 9: 1166 bytes on wire (9328 bits), 1166 bytes captured (9328 bits) on interface unknown, id 0
Ethernet II, Src: IntelCor_5a:74:ae (b0:35:9f:5a:74:ae), Dst: ComdaEnt_ff:94:00 (00:d0:03:ff:94:00)
Internet Protocol Version 4, Src: 172.26.23.10, Dst: 142.250.82.70
Transmission Control Protocol, Src Port: 37390, Dst Port: 443, Seq: 4611, Ack: 352, Len: 1100
Transport Layer Security

No.     Time           Source                Destination           Protocol Length Info
     10 0.028231000    172.26.23.10          142.250.82.70         TCP      180    [TCP segment of a reassembled PDU]

Frame 10: 180 bytes on wire (1440 bits), 180 bytes captured (1440 bits) on interface unknown, id 0
Ethernet II, Src: IntelCor_5a:74:ae (b0:35:9f:5a:74:ae), Dst: ComdaEnt_ff:94:00 (00:d0:03:ff:94:00)
Internet Protocol Version 4, Src: 172.26.23.10, Dst: 142.250.82.70
Transmission Control Protocol, Src Port: 37390, Dst Port: 443, Seq: 5711, Ack: 352, Len: 114
Transport Layer Security

No.     Time           Source                Destination           Protocol Length Info
     11 0.034633000    142.250.82.70         172.26.23.10          TCP      66     443 → 37390 [ACK] Seq=352 Ack=41 Win=235 Len=0 TSval=1681941688 TSecr=1498568285

Frame 11: 66 bytes on wire (528 bits), 66 bytes captured (528 bits) on interface unknown, id 0
Ethernet II, Src: ComdaEnt_ff:94:00 (00:d0:03:ff:94:00), Dst: IntelCor_5a:74:ae (b0:35:9f:5a:74:ae)
Internet Protocol Version 4, Src: 142.250.82.70, Dst: 172.26.23.10
Transmission Control Protocol, Src Port: 443, Dst Port: 37390, Seq: 352, Ack: 41, Len: 0

No.     Time           Source                Destination           Protocol Length Info
     12 0.034671000    172.26.23.10          142.250.82.70         SSLv2    1290   Encrypted Data

Frame 12: 1290 bytes on wire (10320 bits), 1290 bytes captured (10320 bits) on interface unknown, id 0
Ethernet II, Src: IntelCor_5a:74:ae (b0:35:9f:5a:74:ae), Dst: ComdaEnt_ff:94:00 (00:d0:03:ff:94:00)
Internet Protocol Version 4, Src: 172.26.23.10, Dst: 142.250.82.70
Transmission Control Protocol, Src Port: 37390, Dst Port: 443, Seq: 5825, Ack: 352, Len: 1224
Transport Layer Security

No.     Time           Source                Destination           Protocol Length Info
     13 0.036956000    142.250.82.70         172.26.23.10          TCP      66     443 → 37390 [ACK] Seq=352 Ack=2241 Win=227 Len=0 TSval=1681941690 TSecr=1498568290

Frame 13: 66 bytes on wire (528 bits), 66 bytes captured (528 bits) on interface unknown, id 0
Ethernet II, Src: ComdaEnt_ff:94:00 (00:d0:03:ff:94:00), Dst: IntelCor_5a:74:ae (b0:35:9f:5a:74:ae)
Internet Protocol Version 4, Src: 142.250.82.70, Dst: 172.26.23.10
Transmission Control Protocol, Src Port: 443, Dst Port: 37390, Seq: 352, Ack: 2241, Len: 0

No.     Time           Source                Destination           Protocol Length Info
     14 0.038310000    172.26.23.10          142.250.82.70         TCP      828    [TCP segment of a reassembled PDU]

Frame 14: 828 bytes on wire (6624 bits), 828 bytes captured (6624 bits) on interface unknown, id 0
Ethernet II, Src: IntelCor_5a:74:ae (b0:35:9f:5a:74:ae), Dst: ComdaEnt_ff:94:00 (00:d0:03:ff:94:00)
Internet Protocol Version 4, Src: 172.26.23.10, Dst: 142.250.82.70
Transmission Control Protocol, Src Port: 37390, Dst Port: 443, Seq: 7049, Ack: 352, Len: 762
Transport Layer Security

No.     Time           Source                Destination           Protocol Length Info
     15 0.043087000    172.26.23.10          142.250.82.70         TCP      621    [TCP segment of a reassembled PDU]

Frame 15: 621 bytes on wire (4968 bits), 621 bytes captured (4968 bits) on interface unknown, id 0
Ethernet II, Src: IntelCor_5a:74:ae (b0:35:9f:5a:74:ae), Dst: ComdaEnt_ff:94:00 (00:d0:03:ff:94:00)
Internet Protocol Version 4, Src: 172.26.23.10, Dst: 142.250.82.70
Transmission Control Protocol, Src Port: 37390, Dst Port: 443, Seq: 7811, Ack: 352, Len: 555
Transport Layer Security

No.     Time           Source                Destination           Protocol Length Info
     16 0.043602000    142.250.82.70         172.26.23.10          TCP      66     443 → 37390 [ACK] Seq=352 Ack=3397 Win=223 Len=0 TSval=1681941697 TSecr=1498568297

Frame 16: 66 bytes on wire (528 bits), 66 bytes captured (528 bits) on interface unknown, id 0
Ethernet II, Src: ComdaEnt_ff:94:00 (00:d0:03:ff:94:00), Dst: IntelCor_5a:74:ae (b0:35:9f:5a:74:ae)
Internet Protocol Version 4, Src: 142.250.82.70, Dst: 172.26.23.10
Transmission Control Protocol, Src Port: 443, Dst Port: 37390, Seq: 352, Ack: 3397, Len: 0

No.     Time           Source                Destination           Protocol Length Info
     17 0.047390000    172.26.23.10          142.250.82.70         TCP      938    [TCP segment of a reassembled PDU]

Frame 17: 938 bytes on wire (7504 bits), 938 bytes captured (7504 bits) on interface unknown, id 0
Ethernet II, Src: IntelCor_5a:74:ae (b0:35:9f:5a:74:ae), Dst: ComdaEnt_ff:94:00 (00:d0:03:ff:94:00)
Internet Protocol Version 4, Src: 172.26.23.10, Dst: 142.250.82.70
Transmission Control Protocol, Src Port: 37390, Dst Port: 443, Seq: 8366, Ack: 352, Len: 872
Transport Layer Security

No.     Time           Source                Destination           Protocol Length Info
     18 0.048433000    172.26.23.10          142.250.82.70         TCP      186    [TCP segment of a reassembled PDU]

Frame 18: 186 bytes on wire (1488 bits), 186 bytes captured (1488 bits) on interface unknown, id 0
Ethernet II, Src: IntelCor_5a:74:ae (b0:35:9f:5a:74:ae), Dst: ComdaEnt_ff:94:00 (00:d0:03:ff:94:00)
Internet Protocol Version 4, Src: 172.26.23.10, Dst: 142.250.82.70
Transmission Control Protocol, Src Port: 37390, Dst Port: 443, Seq: 9238, Ack: 352, Len: 120
Transport Layer Security

No.     Time           Source                Destination           Protocol Length Info
     19 0.049696000    142.250.82.70         172.26.23.10          TCP      66     443 → 37390 [ACK] Seq=352 Ack=3511 Win=235 Len=0 TSval=1681941703 TSecr=1498568299

Frame 19: 66 bytes on wire (528 bits), 66 bytes captured (528 bits) on interface unknown, id 0
Ethernet II, Src: ComdaEnt_ff:94:00 (00:d0:03:ff:94:00), Dst: IntelCor_5a:74:ae (b0:35:9f:5a:74:ae)
Internet Protocol Version 4, Src: 142.250.82.70, Dst: 172.26.23.10
Transmission Control Protocol, Src Port: 443, Dst Port: 37390, Seq: 352, Ack: 3511, Len: 0

No.     Time           Source                Destination           Protocol Length Info
     20 0.049852000    172.26.23.10          142.250.82.70         TCP      110    [TCP segment of a reassembled PDU]

Frame 20: 110 bytes on wire (880 bits), 110 bytes captured (880 bits) on interface unknown, id 0
Ethernet II, Src: IntelCor_5a:74:ae (b0:35:9f:5a:74:ae), Dst: ComdaEnt_ff:94:00 (00:d0:03:ff:94:00)
Internet Protocol Version 4, Src: 172.26.23.10, Dst: 142.250.82.70
Transmission Control Protocol, Src Port: 37390, Dst Port: 443, Seq: 9358, Ack: 352, Len: 44
Transport Layer Security

No.     Time           Source                Destination           Protocol Length Info
     21 0.051069000    142.250.82.70         172.26.23.10          SSLv2    368    Encrypted Data

Frame 21: 368 bytes on wire (2944 bits), 368 bytes captured (2944 bits) on interface unknown, id 0
Ethernet II, Src: ComdaEnt_ff:94:00 (00:d0:03:ff:94:00), Dst: IntelCor_5a:74:ae (b0:35:9f:5a:74:ae)
Internet Protocol Version 4, Src: 142.250.82.70, Dst: 172.26.23.10
Transmission Control Protocol, Src Port: 443, Dst Port: 37390, Seq: 352, Ack: 4611, Len: 302
Transport Layer Security

No.     Time           Source                Destination           Protocol Length Info
     22 0.052745000    172.26.23.10          142.250.82.70         TCP      939    [TCP segment of a reassembled PDU]

Frame 22: 939 bytes on wire (7512 bits), 939 bytes captured (7512 bits) on interface unknown, id 0
Ethernet II, Src: IntelCor_5a:74:ae (b0:35:9f:5a:74:ae), Dst: ComdaEnt_ff:94:00 (00:d0:03:ff:94:00)
Internet Protocol Version 4, Src: 172.26.23.10, Dst: 142.250.82.70
Transmission Control Protocol, Src Port: 37390, Dst Port: 443, Seq: 9402, Ack: 654, Len: 873
Transport Layer Security

No.     Time           Source                Destination           Protocol Length Info
     23 0.062173000    142.250.82.70         172.26.23.10          TCP      66     443 → 37390 [ACK] Seq=654 Ack=5711 Win=235 Len=0 TSval=1681941715 TSecr=1498568311

Frame 23: 66 bytes on wire (528 bits), 66 bytes captured (528 bits) on interface unknown, id 0
Ethernet II, Src: ComdaEnt_ff:94:00 (00:d0:03:ff:94:00), Dst: IntelCor_5a:74:ae (b0:35:9f:5a:74:ae)
Internet Protocol Version 4, Src: 142.250.82.70, Dst: 172.26.23.10
Transmission Control Protocol, Src Port: 443, Dst Port: 37390, Seq: 654, Ack: 5711, Len: 0

No.     Time           Source                Destination           Protocol Length Info
     24 0.062823000    142.250.82.70         172.26.23.10          TCP      66     443 → 37390 [ACK] Seq=654 Ack=5825 Win=235 Len=0 TSval=1681941716 TSecr=1498568317

Frame 24: 66 bytes on wire (528 bits), 66 bytes captured (528 bits) on interface unknown, id 0
Ethernet II, Src: ComdaEnt_ff:94:00 (00:d0:03:ff:94:00), Dst: IntelCor_5a:74:ae (b0:35:9f:5a:74:ae)
Internet Protocol Version 4, Src: 142.250.82.70, Dst: 172.26.23.10
Transmission Control Protocol, Src Port: 443, Dst Port: 37390, Seq: 654, Ack: 5825, Len: 0

No.     Time           Source                Destination           Protocol Length Info
     25 0.068467000    172.26.23.10          142.250.82.70         TCP      191    [TCP segment of a reassembled PDU]

Frame 25: 191 bytes on wire (1528 bits), 191 bytes captured (1528 bits) on interface unknown, id 0
Ethernet II, Src: IntelCor_5a:74:ae (b0:35:9f:5a:74:ae), Dst: ComdaEnt_ff:94:00 (00:d0:03:ff:94:00)
Internet Protocol Version 4, Src: 172.26.23.10, Dst: 142.250.82.70
Transmission Control Protocol, Src Port: 37390, Dst Port: 443, Seq: 10275, Ack: 654, Len: 125
Transport Layer Security

No.     Time           Source                Destination           Protocol Length Info
     26 0.071655000    172.26.23.10          142.250.82.70         TCP      758    [TCP segment of a reassembled PDU]

Frame 26: 758 bytes on wire (6064 bits), 758 bytes captured (6064 bits) on interface unknown, id 0
Ethernet II, Src: IntelCor_5a:74:ae (b0:35:9f:5a:74:ae), Dst: ComdaEnt_ff:94:00 (00:d0:03:ff:94:00)
Internet Protocol Version 4, Src: 172.26.23.10, Dst: 142.250.82.70
Transmission Control Protocol, Src Port: 37390, Dst Port: 443, Seq: 10400, Ack: 654, Len: 692
Transport Layer Security

No.     Time           Source                Destination           Protocol Length Info
     27 0.073167000    142.250.82.70         172.26.23.10          TCP      66     443 → 37390 [ACK] Seq=654 Ack=7811 Win=228 Len=0 TSval=1681941726 TSecr=1498568324

Frame 27: 66 bytes on wire (528 bits), 66 bytes captured (528 bits) on interface unknown, id 0
Ethernet II, Src: ComdaEnt_ff:94:00 (00:d0:03:ff:94:00), Dst: IntelCor_5a:74:ae (b0:35:9f:5a:74:ae)
Internet Protocol Version 4, Src: 142.250.82.70, Dst: 172.26.23.10
Transmission Control Protocol, Src Port: 443, Dst Port: 37390, Seq: 654, Ack: 7811, Len: 0

No.     Time           Source                Destination           Protocol Length Info
     28 0.075927000    172.26.23.10          142.250.82.70         TCP      923    [TCP segment of a reassembled PDU]

Frame 28: 923 bytes on wire (7384 bits), 923 bytes captured (7384 bits) on interface unknown, id 0
Ethernet II, Src: IntelCor_5a:74:ae (b0:35:9f:5a:74:ae), Dst: ComdaEnt_ff:94:00 (00:d0:03:ff:94:00)
Internet Protocol Version 4, Src: 172.26.23.10, Dst: 142.250.82.70
Transmission Control Protocol, Src Port: 37390, Dst Port: 443, Seq: 11092, Ack: 654, Len: 857
Transport Layer Security

No.     Time           Source                Destination           Protocol Length Info
     29 0.078198000    142.250.82.70         172.26.23.10          TCP      66     443 → 37390 [ACK] Seq=654 Ack=8366 Win=235 Len=0 TSval=1681941731 TSecr=1498568332

Frame 29: 66 bytes on wire (528 bits), 66 bytes captured (528 bits) on interface unknown, id 0
Ethernet II, Src: ComdaEnt_ff:94:00 (00:d0:03:ff:94:00), Dst: IntelCor_5a:74:ae (b0:35:9f:5a:74:ae)
Internet Protocol Version 4, Src: 142.250.82.70, Dst: 172.26.23.10
Transmission Control Protocol, Src Port: 443, Dst Port: 37390, Seq: 654, Ack: 8366, Len: 0

No.     Time           Source                Destination           Protocol Length Info
     30 0.078982000    172.26.23.10          142.250.82.70         TCP      924    [TCP segment of a reassembled PDU]

Frame 30: 924 bytes on wire (7392 bits), 924 bytes captured (7392 bits) on interface unknown, id 0
Ethernet II, Src: IntelCor_5a:74:ae (b0:35:9f:5a:74:ae), Dst: ComdaEnt_ff:94:00 (00:d0:03:ff:94:00)
Internet Protocol Version 4, Src: 172.26.23.10, Dst: 142.250.82.70
Transmission Control Protocol, Src Port: 37390, Dst Port: 443, Seq: 11949, Ack: 654, Len: 858
Transport Layer Security

No.     Time           Source                Destination           Protocol Length Info
     31 0.082023000    142.250.82.70         172.26.23.10          TCP      66     443 → 37390 [ACK] Seq=654 Ack=9238 Win=235 Len=0 TSval=1681941735 TSecr=1498568336

Frame 31: 66 bytes on wire (528 bits), 66 bytes captured (528 bits) on interface unknown, id 0
Ethernet II, Src: ComdaEnt_ff:94:00 (00:d0:03:ff:94:00), Dst: IntelCor_5a:74:ae (b0:35:9f:5a:74:ae)
Internet Protocol Version 4, Src: 142.250.82.70, Dst: 172.26.23.10
Transmission Control Protocol, Src Port: 443, Dst Port: 37390, Seq: 654, Ack: 9238, Len: 0

No.     Time           Source                Destination           Protocol Length Info
     32 0.082920000    142.250.82.70         172.26.23.10          TCP      66     443 → 37390 [ACK] Seq=654 Ack=9358 Win=235 Len=0 TSval=1681941736 TSecr=1498568337

Frame 32: 66 bytes on wire (528 bits), 66 bytes captured (528 bits) on interface unknown, id 0
Ethernet II, Src: ComdaEnt_ff:94:00 (00:d0:03:ff:94:00), Dst: IntelCor_5a:74:ae (b0:35:9f:5a:74:ae)
Internet Protocol Version 4, Src: 142.250.82.70, Dst: 172.26.23.10
Transmission Control Protocol, Src Port: 443, Dst Port: 37390, Seq: 654, Ack: 9358, Len: 0

No.     Time           Source                Destination           Protocol Length Info
     33 0.084544000    142.250.82.70         172.26.23.10          TCP      66     443 → 37390 [ACK] Seq=654 Ack=9402 Win=235 Len=0 TSval=1681941737 TSecr=1498568339

Frame 33: 66 bytes on wire (528 bits), 66 bytes captured (528 bits) on interface unknown, id 0
Ethernet II, Src: ComdaEnt_ff:94:00 (00:d0:03:ff:94:00), Dst: IntelCor_5a:74:ae (b0:35:9f:5a:74:ae)
Internet Protocol Version 4, Src: 142.250.82.70, Dst: 172.26.23.10
Transmission Control Protocol, Src Port: 443, Dst Port: 37390, Seq: 654, Ack: 9402, Len: 0

No.     Time           Source                Destination           Protocol Length Info
     34 0.086079000    172.26.23.10          142.250.82.70         TCP      188    [TCP segment of a reassembled PDU]

Frame 34: 188 bytes on wire (1504 bits), 188 bytes captured (1504 bits) on interface unknown, id 0
Ethernet II, Src: IntelCor_5a:74:ae (b0:35:9f:5a:74:ae), Dst: ComdaEnt_ff:94:00 (00:d0:03:ff:94:00)
Internet Protocol Version 4, Src: 172.26.23.10, Dst: 142.250.82.70
Transmission Control Protocol, Src Port: 37390, Dst Port: 443, Seq: 12807, Ack: 654, Len: 122
Transport Layer Security

No.     Time           Source                Destination           Protocol Length Info
     35 0.087761000    142.250.82.70         172.26.23.10          SSLv2    417    Encrypted Data

Frame 35: 417 bytes on wire (3336 bits), 417 bytes captured (3336 bits) on interface unknown, id 0
Ethernet II, Src: ComdaEnt_ff:94:00 (00:d0:03:ff:94:00), Dst: IntelCor_5a:74:ae (b0:35:9f:5a:74:ae)
Internet Protocol Version 4, Src: 142.250.82.70, Dst: 172.26.23.10
Transmission Control Protocol, Src Port: 443, Dst Port: 37390, Seq: 654, Ack: 10275, Len: 351
Transport Layer Security

No.     Time           Source                Destination           Protocol Length Info
     36 0.100533000    172.26.23.10          142.250.82.70         TCP      110    [TCP segment of a reassembled PDU]

Frame 36: 110 bytes on wire (880 bits), 110 bytes captured (880 bits) on interface unknown, id 0
Ethernet II, Src: IntelCor_5a:74:ae (b0:35:9f:5a:74:ae), Dst: ComdaEnt_ff:94:00 (00:d0:03:ff:94:00)
Internet Protocol Version 4, Src: 172.26.23.10, Dst: 142.250.82.70
Transmission Control Protocol, Src Port: 37390, Dst Port: 443, Seq: 12929, Ack: 1005, Len: 44
Transport Layer Security

No.     Time           Source                Destination           Protocol Length Info
     37 0.106218000    142.250.82.70         172.26.23.10          TCP      66     443 → 37390 [ACK] Seq=1005 Ack=11092 Win=229 Len=0 TSval=1681941759 TSecr=1498568357

Frame 37: 66 bytes on wire (528 bits), 66 bytes captured (528 bits) on interface unknown, id 0
Ethernet II, Src: ComdaEnt_ff:94:00 (00:d0:03:ff:94:00), Dst: IntelCor_5a:74:ae (b0:35:9f:5a:74:ae)
Internet Protocol Version 4, Src: 142.250.82.70, Dst: 172.26.23.10
Transmission Control Protocol, Src Port: 443, Dst Port: 37390, Seq: 1005, Ack: 11092, Len: 0

No.     Time           Source                Destination           Protocol Length Info
     38 0.113804000    142.250.82.70         172.26.23.10          TCP      66     443 → 37390 [ACK] Seq=1005 Ack=12807 Win=223 Len=0 TSval=1681941767 TSecr=1498568365

Frame 38: 66 bytes on wire (528 bits), 66 bytes captured (528 bits) on interface unknown, id 0
Ethernet II, Src: ComdaEnt_ff:94:00 (00:d0:03:ff:94:00), Dst: IntelCor_5a:74:ae (b0:35:9f:5a:74:ae)
Internet Protocol Version 4, Src: 142.250.82.70, Dst: 172.26.23.10
Transmission Control Protocol, Src Port: 443, Dst Port: 37390, Seq: 1005, Ack: 12807, Len: 0

No.     Time           Source                Destination           Protocol Length Info
     39 0.115380000    172.26.23.10          142.250.82.70         TCP      198    [TCP segment of a reassembled PDU]

Frame 39: 198 bytes on wire (1584 bits), 198 bytes captured (1584 bits) on interface unknown, id 0
Ethernet II, Src: IntelCor_5a:74:ae (b0:35:9f:5a:74:ae), Dst: ComdaEnt_ff:94:00 (00:d0:03:ff:94:00)
Internet Protocol Version 4, Src: 172.26.23.10, Dst: 142.250.82.70
Transmission Control Protocol, Src Port: 37390, Dst Port: 443, Seq: 12973, Ack: 1005, Len: 132
Transport Layer Security

No.     Time           Source                Destination           Protocol Length Info
     40 0.126147000    142.250.82.70         172.26.23.10          TCP      66     443 → 37390 [ACK] Seq=1005 Ack=12929 Win=235 Len=0 TSval=1681941779 TSecr=1498568375

Frame 40: 66 bytes on wire (528 bits), 66 bytes captured (528 bits) on interface unknown, id 0
Ethernet II, Src: ComdaEnt_ff:94:00 (00:d0:03:ff:94:00), Dst: IntelCor_5a:74:ae (b0:35:9f:5a:74:ae)
Internet Protocol Version 4, Src: 142.250.82.70, Dst: 172.26.23.10
Transmission Control Protocol, Src Port: 443, Dst Port: 37390, Seq: 1005, Ack: 12929, Len: 0

No.     Time           Source                Destination           Protocol Length Info
     41 0.136251000    142.250.82.70         172.26.23.10          SSLv2    516    Encrypted Data

Frame 41: 516 bytes on wire (4128 bits), 516 bytes captured (4128 bits) on interface unknown, id 0
Ethernet II, Src: ComdaEnt_ff:94:00 (00:d0:03:ff:94:00), Dst: IntelCor_5a:74:ae (b0:35:9f:5a:74:ae)
Internet Protocol Version 4, Src: 142.250.82.70, Dst: 172.26.23.10
Transmission Control Protocol, Src Port: 443, Dst Port: 37390, Seq: 1005, Ack: 12973, Len: 450
Transport Layer Security

No.     Time           Source                Destination           Protocol Length Info
     42 0.140297000    172.26.23.10          142.250.82.70         TCP      191    [TCP segment of a reassembled PDU]

Frame 42: 191 bytes on wire (1528 bits), 191 bytes captured (1528 bits) on interface unknown, id 0
Ethernet II, Src: IntelCor_5a:74:ae (b0:35:9f:5a:74:ae), Dst: ComdaEnt_ff:94:00 (00:d0:03:ff:94:00)
Internet Protocol Version 4, Src: 172.26.23.10, Dst: 142.250.82.70
Transmission Control Protocol, Src Port: 37390, Dst Port: 443, Seq: 13105, Ack: 1455, Len: 125
Transport Layer Security

No.     Time           Source                Destination           Protocol Length Info
     43 0.151399000    172.26.23.10          142.250.82.70         TCP      106    [TCP segment of a reassembled PDU]

Frame 43: 106 bytes on wire (848 bits), 106 bytes captured (848 bits) on interface unknown, id 0
Ethernet II, Src: IntelCor_5a:74:ae (b0:35:9f:5a:74:ae), Dst: ComdaEnt_ff:94:00 (00:d0:03:ff:94:00)
Internet Protocol Version 4, Src: 172.26.23.10, Dst: 142.250.82.70
Transmission Control Protocol, Src Port: 37390, Dst Port: 443, Seq: 13230, Ack: 1455, Len: 40
Transport Layer Security

No.     Time           Source                Destination           Protocol Length Info
     44 0.155774000    142.250.82.70         172.26.23.10          TCP      66     443 → 37390 [ACK] Seq=1455 Ack=13105 Win=235 Len=0 TSval=1681941808 TSecr=1498568404

Frame 44: 66 bytes on wire (528 bits), 66 bytes captured (528 bits) on interface unknown, id 0
Ethernet II, Src: ComdaEnt_ff:94:00 (00:d0:03:ff:94:00), Dst: IntelCor_5a:74:ae (b0:35:9f:5a:74:ae)
Internet Protocol Version 4, Src: 142.250.82.70, Dst: 172.26.23.10
Transmission Control Protocol, Src Port: 443, Dst Port: 37390, Seq: 1455, Ack: 13105, Len: 0

No.     Time           Source                Destination           Protocol Length Info
     45 0.160382000    172.26.23.10          142.250.82.70         TCP      201    [TCP segment of a reassembled PDU]

Frame 45: 201 bytes on wire (1608 bits), 201 bytes captured (1608 bits) on interface unknown, id 0
Ethernet II, Src: IntelCor_5a:74:ae (b0:35:9f:5a:74:ae), Dst: ComdaEnt_ff:94:00 (00:d0:03:ff:94:00)
Internet Protocol Version 4, Src: 172.26.23.10, Dst: 142.250.82.70
Transmission Control Protocol, Src Port: 37390, Dst Port: 443, Seq: 13270, Ack: 1455, Len: 135
Transport Layer Security

No.     Time           Source                Destination           Protocol Length Info
     46 0.165823000    172.26.23.10          142.250.82.70         TCP      863    [TCP segment of a reassembled PDU]

Frame 46: 863 bytes on wire (6904 bits), 863 bytes captured (6904 bits) on interface unknown, id 0
Ethernet II, Src: IntelCor_5a:74:ae (b0:35:9f:5a:74:ae), Dst: ComdaEnt_ff:94:00 (00:d0:03:ff:94:00)
Internet Protocol Version 4, Src: 172.26.23.10, Dst: 142.250.82.70
Transmission Control Protocol, Src Port: 37390, Dst Port: 443, Seq: 13405, Ack: 1455, Len: 797
Transport Layer Security

No.     Time           Source                Destination           Protocol Length Info
     47 0.170189000    172.26.23.10          142.250.82.70         TCP      864    [TCP segment of a reassembled PDU]

Frame 47: 864 bytes on wire (6912 bits), 864 bytes captured (6912 bits) on interface unknown, id 0
Ethernet II, Src: IntelCor_5a:74:ae (b0:35:9f:5a:74:ae), Dst: ComdaEnt_ff:94:00 (00:d0:03:ff:94:00)
Internet Protocol Version 4, Src: 172.26.23.10, Dst: 142.250.82.70
Transmission Control Protocol, Src Port: 37390, Dst Port: 443, Seq: 14202, Ack: 1455, Len: 798
Transport Layer Security

No.     Time           Source                Destination           Protocol Length Info
     48 0.174968000    142.250.82.70         172.26.23.10          SSLv2    404    Encrypted Data

Frame 48: 404 bytes on wire (3232 bits), 404 bytes captured (3232 bits) on interface unknown, id 0
Ethernet II, Src: ComdaEnt_ff:94:00 (00:d0:03:ff:94:00), Dst: IntelCor_5a:74:ae (b0:35:9f:5a:74:ae)
Internet Protocol Version 4, Src: 142.250.82.70, Dst: 172.26.23.10
Transmission Control Protocol, Src Port: 443, Dst Port: 37390, Seq: 1455, Ack: 13230, Len: 338
Transport Layer Security

No.     Time           Source                Destination           Protocol Length Info
     49 0.194542000    142.250.82.70         172.26.23.10          TCP      66     443 → 37390 [ACK] Seq=1793 Ack=13270 Win=235 Len=0 TSval=1681941848 TSecr=1498568440

Frame 49: 66 bytes on wire (528 bits), 66 bytes captured (528 bits) on interface unknown, id 0
Ethernet II, Src: ComdaEnt_ff:94:00 (00:d0:03:ff:94:00), Dst: IntelCor_5a:74:ae (b0:35:9f:5a:74:ae)
Internet Protocol Version 4, Src: 142.250.82.70, Dst: 172.26.23.10
Transmission Control Protocol, Src Port: 443, Dst Port: 37390, Seq: 1793, Ack: 13270, Len: 0

No.     Time           Source                Destination           Protocol Length Info
     50 0.195039000    142.250.82.70         172.26.23.10          TCP      66     443 → 37390 [ACK] Seq=1793 Ack=13405 Win=235 Len=0 TSval=1681941848 TSecr=1498568449

Frame 50: 66 bytes on wire (528 bits), 66 bytes captured (528 bits) on interface unknown, id 0
Ethernet II, Src: ComdaEnt_ff:94:00 (00:d0:03:ff:94:00), Dst: IntelCor_5a:74:ae (b0:35:9f:5a:74:ae)
Internet Protocol Version 4, Src: 142.250.82.70, Dst: 172.26.23.10
Transmission Control Protocol, Src Port: 443, Dst Port: 37390, Seq: 1793, Ack: 13405, Len: 0

No.     Time           Source                Destination           Protocol Length Info
     51 0.200656000    142.250.82.70         172.26.23.10          TCP      66     443 → 37390 [ACK] Seq=1793 Ack=14202 Win=235 Len=0 TSval=1681941854 TSecr=1498568455

Frame 51: 66 bytes on wire (528 bits), 66 bytes captured (528 bits) on interface unknown, id 0
Ethernet II, Src: ComdaEnt_ff:94:00 (00:d0:03:ff:94:00), Dst: IntelCor_5a:74:ae (b0:35:9f:5a:74:ae)
Internet Protocol Version 4, Src: 142.250.82.70, Dst: 172.26.23.10
Transmission Control Protocol, Src Port: 443, Dst Port: 37390, Seq: 1793, Ack: 14202, Len: 0

No.     Time           Source                Destination           Protocol Length Info
     52 0.201781000    172.26.23.10          142.250.82.70         TCP      106    [TCP segment of a reassembled PDU]

Frame 52: 106 bytes on wire (848 bits), 106 bytes captured (848 bits) on interface unknown, id 0
Ethernet II, Src: IntelCor_5a:74:ae (b0:35:9f:5a:74:ae), Dst: ComdaEnt_ff:94:00 (00:d0:03:ff:94:00)
Internet Protocol Version 4, Src: 172.26.23.10, Dst: 142.250.82.70
Transmission Control Protocol, Src Port: 37390, Dst Port: 443, Seq: 15000, Ack: 1793, Len: 40
Transport Layer Security

No.     Time           Source                Destination           Protocol Length Info
     53 0.204558000    172.26.23.10          142.250.82.70         TCP      190    [TCP segment of a reassembled PDU]

Frame 53: 190 bytes on wire (1520 bits), 190 bytes captured (1520 bits) on interface unknown, id 0
Ethernet II, Src: IntelCor_5a:74:ae (b0:35:9f:5a:74:ae), Dst: ComdaEnt_ff:94:00 (00:d0:03:ff:94:00)
Internet Protocol Version 4, Src: 172.26.23.10, Dst: 142.250.82.70
Transmission Control Protocol, Src Port: 37390, Dst Port: 443, Seq: 15040, Ack: 1793, Len: 124
Transport Layer Security

No.     Time           Source                Destination           Protocol Length Info
     54 0.205340000    142.250.82.70         172.26.23.10          TCP      66     443 → 37390 [ACK] Seq=1793 Ack=15000 Win=235 Len=0 TSval=1681941858 TSecr=1498568459

Frame 54: 66 bytes on wire (528 bits), 66 bytes captured (528 bits) on interface unknown, id 0
Ethernet II, Src: ComdaEnt_ff:94:00 (00:d0:03:ff:94:00), Dst: IntelCor_5a:74:ae (b0:35:9f:5a:74:ae)
Internet Protocol Version 4, Src: 142.250.82.70, Dst: 172.26.23.10
Transmission Control Protocol, Src Port: 443, Dst Port: 37390, Seq: 1793, Ack: 15000, Len: 0

No.     Time           Source                Destination           Protocol Length Info
     55 0.209141000    172.26.23.10          142.250.82.70         TCP      184    [TCP segment of a reassembled PDU]

Frame 55: 184 bytes on wire (1472 bits), 184 bytes captured (1472 bits) on interface unknown, id 0
Ethernet II, Src: IntelCor_5a:74:ae (b0:35:9f:5a:74:ae), Dst: ComdaEnt_ff:94:00 (00:d0:03:ff:94:00)
Internet Protocol Version 4, Src: 172.26.23.10, Dst: 142.250.82.70
Transmission Control Protocol, Src Port: 37390, Dst Port: 443, Seq: 15164, Ack: 1793, Len: 118
Transport Layer Security

No.     Time           Source                Destination           Protocol Length Info
     56 0.221720000    172.26.23.10          142.250.82.70         TCP      176    [TCP segment of a reassembled PDU]

Frame 56: 176 bytes on wire (1408 bits), 176 bytes captured (1408 bits) on interface unknown, id 0
Ethernet II, Src: IntelCor_5a:74:ae (b0:35:9f:5a:74:ae), Dst: ComdaEnt_ff:94:00 (00:d0:03:ff:94:00)
Internet Protocol Version 4, Src: 172.26.23.10, Dst: 142.250.82.70
Transmission Control Protocol, Src Port: 37390, Dst Port: 443, Seq: 15282, Ack: 1793, Len: 110
Transport Layer Security

No.     Time           Source                Destination           Protocol Length Info
     57 0.237091000    142.250.82.70         172.26.23.10          SSLv2    521    Encrypted Data

Frame 57: 521 bytes on wire (4168 bits), 521 bytes captured (4168 bits) on interface unknown, id 0
Ethernet II, Src: ComdaEnt_ff:94:00 (00:d0:03:ff:94:00), Dst: IntelCor_5a:74:ae (b0:35:9f:5a:74:ae)
Internet Protocol Version 4, Src: 142.250.82.70, Dst: 172.26.23.10
Transmission Control Protocol, Src Port: 443, Dst Port: 37390, Seq: 1793, Ack: 15040, Len: 455
Transport Layer Security

No.     Time           Source                Destination           Protocol Length Info
     58 0.244048000    142.250.82.70         172.26.23.10          TCP      66     443 → 37390 [ACK] Seq=2248 Ack=15282 Win=235 Len=0 TSval=1681941897 TSecr=1498568493

Frame 58: 66 bytes on wire (528 bits), 66 bytes captured (528 bits) on interface unknown, id 0
Ethernet II, Src: ComdaEnt_ff:94:00 (00:d0:03:ff:94:00), Dst: IntelCor_5a:74:ae (b0:35:9f:5a:74:ae)
Internet Protocol Version 4, Src: 142.250.82.70, Dst: 172.26.23.10
Transmission Control Protocol, Src Port: 443, Dst Port: 37390, Seq: 2248, Ack: 15282, Len: 0

No.     Time           Source                Destination           Protocol Length Info
     59 0.244721000    172.26.23.10          142.250.82.70         TCP      1196   [TCP segment of a reassembled PDU]

Frame 59: 1196 bytes on wire (9568 bits), 1196 bytes captured (9568 bits) on interface unknown, id 0
Ethernet II, Src: IntelCor_5a:74:ae (b0:35:9f:5a:74:ae), Dst: ComdaEnt_ff:94:00 (00:d0:03:ff:94:00)
Internet Protocol Version 4, Src: 172.26.23.10, Dst: 142.250.82.70
Transmission Control Protocol, Src Port: 37390, Dst Port: 443, Seq: 15392, Ack: 2248, Len: 1130
Transport Layer Security

No.     Time           Source                Destination           Protocol Length Info
     60 0.245023000    172.26.23.10          142.250.82.70         TCP      1197   [TCP segment of a reassembled PDU]

Frame 60: 1197 bytes on wire (9576 bits), 1197 bytes captured (9576 bits) on interface unknown, id 0
Ethernet II, Src: IntelCor_5a:74:ae (b0:35:9f:5a:74:ae), Dst: ComdaEnt_ff:94:00 (00:d0:03:ff:94:00)
Internet Protocol Version 4, Src: 172.26.23.10, Dst: 142.250.82.70
Transmission Control Protocol, Src Port: 37390, Dst Port: 443, Seq: 16522, Ack: 2248, Len: 1131
Transport Layer Security

No.     Time           Source                Destination           Protocol Length Info
     61 0.246471000    172.26.23.10          142.250.82.70         TCP      1197   [TCP segment of a reassembled PDU]

Frame 61: 1197 bytes on wire (9576 bits), 1197 bytes captured (9576 bits) on interface unknown, id 0
Ethernet II, Src: IntelCor_5a:74:ae (b0:35:9f:5a:74:ae), Dst: ComdaEnt_ff:94:00 (00:d0:03:ff:94:00)
Internet Protocol Version 4, Src: 172.26.23.10, Dst: 142.250.82.70
Transmission Control Protocol, Src Port: 37390, Dst Port: 443, Seq: 17653, Ack: 2248, Len: 1131
Transport Layer Security

No.     Time           Source                Destination           Protocol Length Info
     62 0.248439000    172.26.23.10          142.250.82.70         TCP      176    [TCP segment of a reassembled PDU]

Frame 62: 176 bytes on wire (1408 bits), 176 bytes captured (1408 bits) on interface unknown, id 0
Ethernet II, Src: IntelCor_5a:74:ae (b0:35:9f:5a:74:ae), Dst: ComdaEnt_ff:94:00 (00:d0:03:ff:94:00)
Internet Protocol Version 4, Src: 172.26.23.10, Dst: 142.250.82.70
Transmission Control Protocol, Src Port: 37390, Dst Port: 443, Seq: 18784, Ack: 2248, Len: 110
Transport Layer Security

No.     Time           Source                Destination           Protocol Length Info
     63 0.251257000    172.26.23.10          142.250.82.70         TCP      106    [TCP segment of a reassembled PDU]

Frame 63: 106 bytes on wire (848 bits), 106 bytes captured (848 bits) on interface unknown, id 0
Ethernet II, Src: IntelCor_5a:74:ae (b0:35:9f:5a:74:ae), Dst: ComdaEnt_ff:94:00 (00:d0:03:ff:94:00)
Internet Protocol Version 4, Src: 172.26.23.10, Dst: 142.250.82.70
Transmission Control Protocol, Src Port: 37390, Dst Port: 443, Seq: 18894, Ack: 2248, Len: 40
Transport Layer Security

No.     Time           Source                Destination           Protocol Length Info
     64 0.253267000    172.26.23.10          142.250.82.70         TCP      1197   [TCP segment of a reassembled PDU]

Frame 64: 1197 bytes on wire (9576 bits), 1197 bytes captured (9576 bits) on interface unknown, id 0
Ethernet II, Src: IntelCor_5a:74:ae (b0:35:9f:5a:74:ae), Dst: ComdaEnt_ff:94:00 (00:d0:03:ff:94:00)
Internet Protocol Version 4, Src: 172.26.23.10, Dst: 142.250.82.70
Transmission Control Protocol, Src Port: 37390, Dst Port: 443, Seq: 18934, Ack: 2248, Len: 1131
Transport Layer Security

No.     Time           Source                Destination           Protocol Length Info
     65 0.260412000    172.26.23.10          142.250.82.70         TCP      1197   [TCP segment of a reassembled PDU]

Frame 65: 1197 bytes on wire (9576 bits), 1197 bytes captured (9576 bits) on interface unknown, id 0
Ethernet II, Src: IntelCor_5a:74:ae (b0:35:9f:5a:74:ae), Dst: ComdaEnt_ff:94:00 (00:d0:03:ff:94:00)
Internet Protocol Version 4, Src: 172.26.23.10, Dst: 142.250.82.70
Transmission Control Protocol, Src Port: 37390, Dst Port: 443, Seq: 20065, Ack: 2248, Len: 1131
Transport Layer Security

No.     Time           Source                Destination           Protocol Length Info
     66 0.260548000    142.250.82.70         172.26.23.10          TCP      66     443 → 37390 [ACK] Seq=2248 Ack=15392 Win=235 Len=0 TSval=1681941914 TSecr=1498568511

Frame 66: 66 bytes on wire (528 bits), 66 bytes captured (528 bits) on interface unknown, id 0
Ethernet II, Src: ComdaEnt_ff:94:00 (00:d0:03:ff:94:00), Dst: IntelCor_5a:74:ae (b0:35:9f:5a:74:ae)
Internet Protocol Version 4, Src: 142.250.82.70, Dst: 172.26.23.10
Transmission Control Protocol, Src Port: 443, Dst Port: 37390, Seq: 2248, Ack: 15392, Len: 0

No.     Time           Source                Destination           Protocol Length Info
     67 0.263223000    172.26.23.10          142.250.82.70         TCP      902    [TCP segment of a reassembled PDU]

Frame 67: 902 bytes on wire (7216 bits), 902 bytes captured (7216 bits) on interface unknown, id 0
Ethernet II, Src: IntelCor_5a:74:ae (b0:35:9f:5a:74:ae), Dst: ComdaEnt_ff:94:00 (00:d0:03:ff:94:00)
Internet Protocol Version 4, Src: 172.26.23.10, Dst: 142.250.82.70
Transmission Control Protocol, Src Port: 37390, Dst Port: 443, Seq: 21196, Ack: 2248, Len: 836
Transport Layer Security

