"No.","Time","Source","Destination","Protocol","Length","Info"
"1","0.000000000","fe80::1","ff02::1","ICMPv6","118","Router Advertisement from 30:e9:8e:ec:27:d4"
"2","0.008236985","fe80::7a1f:e4d3:9143:d4d9","ff02::16","ICMPv6","130","Multicast Listener Report Message v2"
"3","0.148272810","fe80::7a1f:e4d3:9143:d4d9","ff02::16","ICMPv6","130","Multicast Listener Report Message v2"
"4","1.162546504","2001:818:ea8d:1500:9a2:8687:28ad:13a4","2a05:d01c:dc6:4401:3775:b74b:1af3:355b","TLSv1.2","260","Application Model.Data"
"5","1.168881582","192.168.1.84","192.168.1.1","DNS","132","Standard query 0x5a65 PTR 1.0.0.0.0.0.0.0.0.0.0.0.0.0.0.0.0.0.0.0.0.0.0.0.0.0.0.0.0.8.e.f.ip6.arpa"
"6","1.169017972","192.168.1.84","192.168.1.1","DNS","132","Standard query 0xc8db PTR 9.d.4.d.3.4.1.9.3.d.4.e.f.1.a.7.0.0.0.0.0.0.0.0.0.0.0.0.0.8.e.f.ip6.arpa"
"7","1.169082511","192.168.1.84","192.168.1.1","DNS","132","Standard query 0x9c33 PTR 6.1.0.0.0.0.0.0.0.0.0.0.0.0.0.0.0.0.0.0.0.0.0.0.0.0.0.0.2.0.f.f.ip6.arpa"
"8","1.172700110","192.168.1.1","192.168.1.84","DNS","156","Standard query response 0x5a65 PTR 1.0.0.0.0.0.0.0.0.0.0.0.0.0.0.0.0.0.0.0.0.0.0.0.0.0.0.0.0.8.e.f.ip6.arpa PTR vodafonegw"
"9","1.172700686","192.168.1.1","192.168.1.84","DNS","132","Standard query response 0xc8db No such name PTR 9.d.4.d.3.4.1.9.3.d.4.e.f.1.a.7.0.0.0.0.0.0.0.0.0.0.0.0.0.8.e.f.ip6.arpa"
"10","1.173570451","192.168.1.1","192.168.1.84","DNS","132","Standard query response 0x9c33 No such name PTR 6.1.0.0.0.0.0.0.0.0.0.0.0.0.0.0.0.0.0.0.0.0.0.0.0.0.0.0.2.0.f.f.ip6.arpa"
"11","1.202925002","2a05:d01c:dc6:4401:3775:b74b:1af3:355b","2001:818:ea8d:1500:9a2:8687:28ad:13a4","TLSv1.2","291","Application Model.Data"
"12","1.203009780","2001:818:ea8d:1500:9a2:8687:28ad:13a4","2a05:d01c:dc6:4401:3775:b74b:1af3:355b","TCP","86","42026  >  443 [ACK] Seq=175 Ack=206 Win=500 Len=0 TSval=52104712 TSecr=748149646"
"13","1.374932638","192.168.1.84","224.0.0.22","IGMPv3","54","Membership Report / Join group 224.0.0.251 for any sources"
"14","1.580859481","129.159.81.58","192.168.1.84","TLSv1.2","112","Application Model.Data"
"15","1.581293765","192.168.1.84","129.159.81.58","TCP","66","46376  >  443 [FIN, ACK] Seq=1 Ack=47 Win=501 Len=0 TSval=2615438913 TSecr=3170202874"
"16","1.697915441","129.159.81.58","192.168.1.84","TCP","66","443  >  46376 [FIN, ACK] Seq=47 Ack=2 Win=477 Len=0 TSval=3170202991 TSecr=2615438913"
"17","1.697949056","192.168.1.84","129.159.81.58","TCP","66","46376  >  443 [ACK] Seq=2 Ack=48 Win=501 Len=0 TSval=2615439030 TSecr=3170202991"
"18","2.168182442","192.168.1.84","192.168.1.1","DNS","132","Standard query 0xebd9 PTR 4.a.3.1.d.a.8.2.7.8.6.8.2.a.9.0.0.0.5.1.d.8.a.e.8.1.8.0.1.0.0.2.ip6.arpa"
"19","2.168263031","192.168.1.84","192.168.1.1","DNS","132","Standard query 0x7f91 PTR b.5.5.3.3.f.a.1.b.4.7.b.5.7.7.3.1.0.4.4.6.c.d.0.c.1.0.d.5.0.a.2.ip6.arpa"
"20","2.168293311","192.168.1.84","192.168.1.1","DNS","85","Standard query 0xb801 PTR 84.1.168.192.in-addr.arpa"
"21","2.168317595","192.168.1.84","192.168.1.1","DNS","84","Standard query 0x1a67 PTR 1.1.168.192.in-addr.arpa"
"22","2.168339352","192.168.1.84","192.168.1.1","DNS","83","Standard query 0xca9c PTR 22.0.0.224.in-addr.arpa"
"23","2.168361528","192.168.1.84","192.168.1.1","DNS","86","Standard query 0x9889 PTR 58.81.159.129.in-addr.arpa"
"24","2.174642386","192.168.1.1","192.168.1.84","DNS","132","Standard query response 0xebd9 No such name PTR 4.a.3.1.d.a.8.2.7.8.6.8.2.a.9.0.0.0.5.1.d.8.a.e.8.1.8.0.1.0.0.2.ip6.arpa"
"25","2.175484982","192.168.1.1","192.168.1.84","DNS","109","Standard query response 0xb801 PTR 84.1.168.192.in-addr.arpa PTR wtv-pc.lan"
"26","2.175485196","192.168.1.1","192.168.1.84","DNS","108","Standard query response 0x1a67 PTR 1.1.168.192.in-addr.arpa PTR vodafonegw"
"27","2.175485258","192.168.1.1","192.168.1.84","DNS","111","Standard query response 0xca9c PTR 22.0.0.224.in-addr.arpa PTR igmp.mcast.net"
"28","2.205847161","192.168.1.1","192.168.1.84","DNS","203","Standard query response 0x7f91 No such name PTR b.5.5.3.3.f.a.1.b.4.7.b.5.7.7.3.1.0.4.4.6.c.d.0.c.1.0.d.5.0.a.2.ip6.arpa SOA dns-external-master.amazon.com"
"29","2.219206406","192.168.1.1","192.168.1.84","DNS","161","Standard query response 0x9889 No such name PTR 58.81.159.129.in-addr.arpa SOA ns1.p04.dynect.net"
"30","3.565786238","192.168.1.84","13.248.142.92","TLSv1.2","177","Application Model.Data"
"31","3.576926831","13.248.142.92","192.168.1.84","TCP","66","443  >  33458 [ACK] Seq=1 Ack=112 Win=1979 Len=0 TSval=429376713 TSecr=2665690273"
"32","3.669144851","192.168.1.84","3.235.82.193","TLSv1.2","283","Application Model.Data"
"33","3.783980311","3.235.82.193","192.168.1.84","TCP","66","443  >  38764 [ACK] Seq=1 Ack=218 Win=27 Len=0 TSval=2891993432 TSecr=1389350090"
"34","3.783980725","3.235.82.193","192.168.1.84","TLSv1.2","261","Application Model.Data"
"35","3.784048305","192.168.1.84","3.235.82.193","TCP","66","38764  >  443 [ACK] Seq=218 Ack=196 Win=500 Len=0 TSval=1389350205 TSecr=2891993432"
"36","4.168608461","192.168.1.84","192.168.1.1","DNS","86","Standard query 0x01bb PTR 92.142.248.13.in-addr.arpa"
"37","4.168752056","192.168.1.84","192.168.1.1","DNS","85","Standard query 0x8da4 PTR 193.82.235.3.in-addr.arpa"
"38","4.172877072","192.168.1.1","192.168.1.84","DNS","139","Standard query response 0x8da4 PTR 193.82.235.3.in-addr.arpa PTR ec2-3-235-82-193.compute-1.amazonaws.com"
"39","4.223364707","192.168.1.1","192.168.1.84","DNS","455","Standard query response 0x01bb PTR 92.142.248.13.in-addr.arpa PTR a592aa0a35a8dbaf5.awsglobalaccelerator.com NS ns-265.awsdns-33.com NS ns-1987.awsdns-56.co.uk NS ns-946.awsdns-54.net NS ns-1329.awsdns-38.org A 205.251.197.49 A 205.251.199.195 A 205.251.193.9 A 205.251.195.178 AAAA 2600:9000:5305:3100::1 AAAA 2600:9000:5307:c300::1 AAAA 2600:9000:5301:900::1 AAAA 2600:9000:5303:b200::1"
"40","6.076995396","2a05:d01c:dc6:4401:3775:b74b:1af3:355b","2001:818:ea8d:1500:9a2:8687:28ad:13a4","TLSv1.2","1068","Application Model.Data"
"41","6.077037774","2001:818:ea8d:1500:9a2:8687:28ad:13a4","2a05:d01c:dc6:4401:3775:b74b:1af3:355b","TCP","86","42026  >  443 [ACK] Seq=175 Ack=1188 Win=493 Len=0 TSval=52109586 TSecr=748154519"
"42","6.077615723","2a05:d01c:dc6:4401:3775:b74b:1af3:355b","2001:818:ea8d:1500:9a2:8687:28ad:13a4","TLSv1.2","918","Application Model.Data"
"43","6.077631466","2001:818:ea8d:1500:9a2:8687:28ad:13a4","2a05:d01c:dc6:4401:3775:b74b:1af3:355b","TCP","86","42026  >  443 [ACK] Seq=175 Ack=2020 Win=493 Len=0 TSval=52109587 TSecr=748154521"
"44","6.095230703","2a05:d01c:dc6:4401:3775:b74b:1af3:355b","2001:818:ea8d:1500:9a2:8687:28ad:13a4","TLSv1.2","5322","Application Model.Data"
"45","6.095231041","2a05:d01c:dc6:4401:3775:b74b:1af3:355b","2001:818:ea8d:1500:9a2:8687:28ad:13a4","TLSv1.2","143","Application Model.Data"
"46","6.095284446","2001:818:ea8d:1500:9a2:8687:28ad:13a4","2a05:d01c:dc6:4401:3775:b74b:1af3:355b","TCP","86","42026  >  443 [ACK] Seq=175 Ack=7256 Win=453 Len=0 TSval=52109604 TSecr=748154538"
"47","6.095313414","2001:818:ea8d:1500:9a2:8687:28ad:13a4","2a05:d01c:dc6:4401:3775:b74b:1af3:355b","TCP","86","42026  >  443 [ACK] Seq=175 Ack=7313 Win=453 Len=0 TSval=52109604 TSecr=748154538"
"48","6.173230828","192.168.1.84","13.248.142.92","TLSv1.2","571","Application Model.Data"
"49","6.173750952","192.168.1.84","13.248.142.92","TLSv1.2","344","Application Model.Data"
"50","6.184655810","13.248.142.92","192.168.1.84","TCP","66","443  >  33458 [ACK] Seq=1 Ack=617 Win=1979 Len=0 TSval=429376974 TSecr=2665692880"
"51","6.184656406","13.248.142.92","192.168.1.84","TCP","66","443  >  33458 [ACK] Seq=1 Ack=895 Win=1979 Len=0 TSval=429376974 TSecr=2665692881"
"52","6.226572339","192.168.1.84","13.248.142.92","TLSv1.2","313","Application Model.Data"
"53","6.227299780","192.168.1.84","13.248.142.92","TLSv1.2","313","Application Model.Data"
"54","6.228147779","192.168.1.84","13.248.142.92","TLSv1.2","291","Application Model.Data"
"55","6.236800073","13.248.142.92","192.168.1.84","TCP","66","443  >  33458 [ACK] Seq=1 Ack=1142 Win=1979 Len=0 TSval=429376979 TSecr=2665692934"
"56","6.236800300","13.248.142.92","192.168.1.84","TCP","66","443  >  33458 [ACK] Seq=1 Ack=1389 Win=1979 Len=0 TSval=429376979 TSecr=2665692934"
"57","6.238098847","13.248.142.92","192.168.1.84","TCP","66","443  >  33458 [ACK] Seq=1 Ack=1614 Win=1979 Len=0 TSval=429376979 TSecr=2665692935"
"58","6.303219955","192.168.1.84","13.248.142.92","TLSv1.2","431","Application Model.Data"
"59","6.303717564","192.168.1.84","13.248.142.92","TLSv1.2","345","Application Model.Data"
"60","6.306786833","2001:818:ea8d:1500:9a2:8687:28ad:13a4","2a05:d01c:dc6:4401:3775:b74b:1af3:355b","TLSv1.2","345","Application Model.Data"
"61","6.306926937","192.168.1.84","192.168.1.1","DNS","110","Standard query 0x8789 A meet-jit-si-eu-west-2a-s46-jvb-42-74-105.jitsi.net"
"62","6.306942707","192.168.1.84","192.168.1.1","DNS","110","Standard query 0x7885 AAAA meet-jit-si-eu-west-2a-s46-jvb-42-74-105.jitsi.net"
"63","6.307228734","2001:818:ea8d:1500:9a2:8687:28ad:13a4","2a05:d01c:dc6:4401:3775:b74b:1af3:355b","TLSv1.2","154","Application Model.Data"
"64","6.309661603","192.168.1.84","13.248.142.92","TLSv1.2","244","Application Model.Data"
"65","6.309904052","192.168.1.84","13.248.142.92","TLSv1.2","244","Application Model.Data"
"66","6.314367069","192.168.1.84","13.248.142.92","TCP","1466","33458  >  443 [ACK] Seq=2614 Ack=1 Win=501 Len=1400 TSval=2665693021 TSecr=429376979 [TCP segment of a reassembled PDU]"
"67","6.314389499","192.168.1.84","13.248.142.92","TCP","1466","33458  >  443 [ACK] Seq=4014 Ack=1 Win=501 Len=1400 TSval=2665693021 TSecr=429376979 [TCP segment of a reassembled PDU]"
"68","6.314391382","192.168.1.84","13.248.142.92","TCP","1466","33458  >  443 [ACK] Seq=5414 Ack=1 Win=501 Len=1400 TSval=2665693021 TSecr=429376979 [TCP segment of a reassembled PDU]"
"69","6.314392993","192.168.1.84","13.248.142.92","TCP","1466","33458  >  443 [ACK] Seq=6814 Ack=1 Win=501 Len=1400 TSval=2665693021 TSecr=429376979 [TCP segment of a reassembled PDU]"
"70","6.314394460","192.168.1.84","13.248.142.92","TLSv1.2","185","Application Model.Data"
"71","6.316515379","13.248.142.92","192.168.1.84","TCP","66","443  >  33458 [ACK] Seq=1 Ack=1979 Win=1979 Len=0 TSval=429376987 TSecr=2665693010"
"72","6.316515570","13.248.142.92","192.168.1.84","TCP","66","443  >  33458 [ACK] Seq=1 Ack=2258 Win=1979 Len=0 TSval=429376987 TSecr=2665693011"
"73","6.319111386","13.248.142.92","192.168.1.84","TCP","66","443  >  33458 [ACK] Seq=1 Ack=2436 Win=1979 Len=0 TSval=429376987 TSecr=2665693017"
"74","6.320190897","13.248.142.92","192.168.1.84","TCP","66","443  >  33458 [ACK] Seq=1 Ack=2614 Win=1979 Len=0 TSval=429376987 TSecr=2665693017"
"75","6.324550919","13.248.142.92","192.168.1.84","TCP","66","443  >  33458 [ACK] Seq=1 Ack=4014 Win=1979 Len=0 TSval=429376988 TSecr=2665693021"
"76","6.324552260","13.248.142.92","192.168.1.84","TCP","66","443  >  33458 [ACK] Seq=1 Ack=5414 Win=1979 Len=0 TSval=429376988 TSecr=2665693021"
"77","6.325661414","13.248.142.92","192.168.1.84","TCP","66","443  >  33458 [ACK] Seq=1 Ack=6814 Win=1979 Len=0 TSval=429376988 TSecr=2665693021"
"78","6.326638850","13.248.142.92","192.168.1.84","TCP","66","443  >  33458 [ACK] Seq=1 Ack=8214 Win=1979 Len=0 TSval=429376988 TSecr=2665693021"
"79","6.326639053","13.248.142.92","192.168.1.84","TCP","66","443  >  33458 [ACK] Seq=1 Ack=8333 Win=1979 Len=0 TSval=429376988 TSecr=2665693021"
"80","6.329851862","192.168.1.1","192.168.1.84","DNS","439","Standard query response 0x8789 A meet-jit-si-eu-west-2a-s46-jvb-42-74-105.jitsi.net A 152.67.151.45 NS ns-840.awsdns-41.net NS ns-1039.awsdns-01.org NS ns-271.awsdns-33.com NS ns-1595.awsdns-07.co.uk A 205.251.196.15 A 205.251.198.59 A 205.251.193.15 A 205.251.195.72 AAAA 2600:9000:5304:f00::1 AAAA 2600:9000:5306:3b00::1 AAAA 2600:9000:5301:f00::1 AAAA 2600:9000:5303:4800::1"
"81","6.329852063","192.168.1.1","192.168.1.84","DNS","197","Standard query response 0x7885 AAAA meet-jit-si-eu-west-2a-s46-jvb-42-74-105.jitsi.net SOA ns-1595.awsdns-41.co.uk"
"82","6.330492934","192.168.1.84","13.248.142.92","TCP","1466","33458  >  443 [ACK] Seq=8333 Ack=1 Win=501 Len=1400 TSval=2665693038 TSecr=429376988 [TCP segment of a reassembled PDU]"
"83","6.330510105","192.168.1.84","13.248.142.92","TCP","1466","33458  >  443 [ACK] Seq=9733 Ack=1 Win=501 Len=1400 TSval=2665693038 TSecr=429376988 [TCP segment of a reassembled PDU]"
"84","6.330513067","192.168.1.84","13.248.142.92","TCP","1466","33458  >  443 [ACK] Seq=11133 Ack=1 Win=501 Len=1400 TSval=2665693038 TSecr=429376988 [TCP segment of a reassembled PDU]"
"85","6.330515609","192.168.1.84","13.248.142.92","TCP","1466","33458  >  443 [ACK] Seq=12533 Ack=1 Win=501 Len=1400 TSval=2665693038 TSecr=429376988 [TCP segment of a reassembled PDU]"
"86","6.330518084","192.168.1.84","13.248.142.92","TLSv1.2","147","Application Model.Data"
"87","6.330625024","192.168.1.84","152.67.151.45","TCP","74","41230  >  443 [SYN] Seq=0 Win=64240 Len=0 MSS=1460 SACK_PERM=1 TSval=530678350 TSecr=0 WS=128"
"88","6.335162543","192.168.1.84","13.248.142.92","TLSv1.2","313","Application Model.Data"
"89","6.335426921","192.168.1.84","13.248.142.92","TLSv1.2","313","Application Model.Data"
"90","6.340733628","13.248.142.92","192.168.1.84","TCP","66","443  >  33458 [ACK] Seq=1 Ack=9733 Win=1979 Len=0 TSval=429376989 TSecr=2665693038"
"91","6.340733785","13.248.142.92","192.168.1.84","TCP","66","443  >  33458 [ACK] Seq=1 Ack=11133 Win=1979 Len=0 TSval=429376989 TSecr=2665693038"
"92","6.341761109","13.248.142.92","192.168.1.84","TCP","66","443  >  33458 [ACK] Seq=1 Ack=13933 Win=1979 Len=0 TSval=429376989 TSecr=2665693038"
"93","6.341761200","13.248.142.92","192.168.1.84","TCP","66","443  >  33458 [ACK] Seq=1 Ack=14014 Win=1979 Len=0 TSval=429376989 TSecr=2665693038"
"94","6.342646197","192.168.1.84","13.248.142.92","TCP","1466","33458  >  443 [ACK] Seq=14508 Ack=1 Win=501 Len=1400 TSval=2665693050 TSecr=429376989 [TCP segment of a reassembled PDU]"
"95","6.342660180","192.168.1.84","13.248.142.92","TLSv1.2","1283","Application Model.Data"
"96","6.344381745","13.248.142.92","192.168.1.84","TCP","66","443  >  33458 [ACK] Seq=1 Ack=14261 Win=1979 Len=0 TSval=429376990 TSecr=2665693042"
"97","6.345475624","13.248.142.92","192.168.1.84","TCP","66","443  >  33458 [ACK] Seq=1 Ack=14508 Win=1979 Len=0 TSval=429376990 TSecr=2665693043"
"98","6.346516907","2a05:d01c:dc6:4401:3775:b74b:1af3:355b","2001:818:ea8d:1500:9a2:8687:28ad:13a4","TCP","86","443  >  42026 [ACK] Seq=7313 Ack=502 Win=184 Len=0 TSval=748154790 TSecr=52109816"
"99","6.347243343","192.168.1.84","13.248.142.92","TLSv1.2","263","Application Model.Data"
"100","6.347458994","192.168.1.84","13.248.142.92","TLSv1.2","253","Application Model.Data"
"101","6.352802469","13.248.142.92","192.168.1.84","TCP","66","443  >  33458 [ACK] Seq=1 Ack=17125 Win=1979 Len=0 TSval=429376991 TSecr=2665693050"
"102","6.357143894","13.248.142.92","192.168.1.84","TCP","66","443  >  33458 [ACK] Seq=1 Ack=17322 Win=1979 Len=0 TSval=429376991 TSecr=2665693054"
"103","6.357144242","13.248.142.92","192.168.1.84","TCP","66","443  >  33458 [ACK] Seq=1 Ack=17509 Win=1979 Len=0 TSval=429376991 TSecr=2665693055"
"104","6.360158354","2001:818:ea8d:1500:9a2:8687:28ad:13a4","2a05:d01c:dc6:4401:3775:b74b:1af3:355b","TCP","1514","42026  >  443 [ACK] Seq=502 Ack=7313 Win=501 Len=1428 TSval=52109869 TSecr=748154790 [TCP segment of a reassembled PDU]"
"105","6.360174404","2001:818:ea8d:1500:9a2:8687:28ad:13a4","2a05:d01c:dc6:4401:3775:b74b:1af3:355b","TCP","1514","42026  >  443 [ACK] Seq=1930 Ack=7313 Win=501 Len=1428 TSval=52109869 TSecr=748154790 [TCP segment of a reassembled PDU]"
"106","6.360176541","2001:818:ea8d:1500:9a2:8687:28ad:13a4","2a05:d01c:dc6:4401:3775:b74b:1af3:355b","TCP","1514","42026  >  443 [PSH, ACK] Seq=3358 Ack=7313 Win=501 Len=1428 TSval=52109869 TSecr=748154790 [TCP segment of a reassembled PDU]"
"107","6.360182627","2001:818:ea8d:1500:9a2:8687:28ad:13a4","2a05:d01c:dc6:4401:3775:b74b:1af3:355b","TCP","1514","42026  >  443 [ACK] Seq=4786 Ack=7313 Win=501 Len=1428 TSval=52109869 TSecr=748154790 [TCP segment of a reassembled PDU]"
"108","6.360184452","2001:818:ea8d:1500:9a2:8687:28ad:13a4","2a05:d01c:dc6:4401:3775:b74b:1af3:355b","TCP","1514","42026  >  443 [ACK] Seq=6214 Ack=7313 Win=501 Len=1428 TSval=52109869 TSecr=748154790 [TCP segment of a reassembled PDU]"
"109","6.360185977","2001:818:ea8d:1500:9a2:8687:28ad:13a4","2a05:d01c:dc6:4401:3775:b74b:1af3:355b","TCP","1514","42026  >  443 [PSH, ACK] Seq=7642 Ack=7313 Win=501 Len=1428 TSval=52109869 TSecr=748154790 [TCP segment of a reassembled PDU]"
"110","6.360956850","192.168.1.84","13.248.142.92","TLSv1.2","244","Application Model.Data"
"111","6.363115139","192.168.1.84","13.248.142.92","TLSv1.2","244","Application Model.Data"
"112","6.363132772","2001:818:ea8d:1500:9a2:8687:28ad:13a4","2a05:d01c:dc6:4401:3775:b74b:1af3:355b","TCP","1514","42026  >  443 [ACK] Seq=9070 Ack=7313 Win=501 Len=1428 TSval=52109872 TSecr=748154790 [TCP segment of a reassembled PDU]"
"113","6.363136669","2001:818:ea8d:1500:9a2:8687:28ad:13a4","2a05:d01c:dc6:4401:3775:b74b:1af3:355b","TLSv1.2","650","Application Model.Data"
"114","6.364450036","192.168.1.84","13.248.142.92","TLSv1.2","264","Application Model.Data"
"115","6.364594470","192.168.1.84","13.248.142.92","TLSv1.2","294","Application Model.Data"
"116","6.365182830","192.168.1.84","13.248.142.92","TLSv1.2","482","Application Model.Data, Application Model.Data"
"117","6.365311898","192.168.1.84","13.248.142.92","TLSv1.2","254","Application Model.Data"
"118","6.365785444","192.168.1.84","13.248.142.92","TLSv1.2","292","Application Model.Data"
"119","6.367470983","192.168.1.84","13.248.142.92","TLSv1.2","259","Application Model.Data"
"120","6.367591328","2001:818:ea8d:1500:9a2:8687:28ad:13a4","2a05:d01c:dc6:4401:3775:b74b:1af3:355b","TLSv1.2","147","Application Model.Data"
"121","6.368031627","192.168.1.84","13.248.142.92","TCP","1466","33458  >  443 [ACK] Seq=19314 Ack=1 Win=501 Len=1400 TSval=2665693075 TSecr=429376991 [TCP segment of a reassembled PDU]"
"122","6.368039089","192.168.1.84","13.248.142.92","TLSv1.2","1415","Application Model.Data"
"123","6.373113501","192.168.1.84","13.248.142.92","TCP","1466","33458  >  443 [ACK] Seq=22063 Ack=1 Win=501 Len=1400 TSval=2665693080 TSecr=429376991 [TCP segment of a reassembled PDU]"
"124","6.373130555","192.168.1.84","13.248.142.92","TCP","1466","33458  >  443 [ACK] Seq=23463 Ack=1 Win=501 Len=1400 TSval=2665693080 TSecr=429376991 [TCP segment of a reassembled PDU]"
"125","6.373135793","192.168.1.84","13.248.142.92","TLSv1.2","711","Application Model.Data"
"126","6.373148175","13.248.142.92","192.168.1.84","TCP","66","443  >  33458 [ACK] Seq=1 Ack=17865 Win=1979 Len=0 TSval=429376992 TSecr=2665693068"
"127","6.374518068","13.248.142.92","192.168.1.84","TCP","66","443  >  33458 [ACK] Seq=1 Ack=18063 Win=1979 Len=0 TSval=429376993 TSecr=2665693072"
"128","6.374520828","192.168.1.84","192.168.1.1","DNS","91","Standard query 0xe34f A meet-jit-si-turnrelay.jitsi.net"
"129","6.374518438","152.67.151.45","192.168.1.84","TCP","74","443  >  41230 [SYN, ACK] Seq=0 Ack=1 Win=62636 Len=0 MSS=1412 SACK_PERM=1 TSval=1255420622 TSecr=530678350 WS=2048"
"130","6.374541591","192.168.1.84","192.168.1.1","DNS","91","Standard query 0xd04b AAAA meet-jit-si-turnrelay.jitsi.net"
"131","6.374559017","192.168.1.84","152.67.151.45","TCP","66","41230  >  443 [ACK] Seq=1 Ack=1 Win=64256 Len=0 TSval=530678394 TSecr=1255420622"
"132","6.374518463","13.248.142.92","192.168.1.84","TCP","66","443  >  33458 [ACK] Seq=1 Ack=18291 Win=1979 Len=0 TSval=429376993 TSecr=2665693072"
"133","6.374518497","13.248.142.92","192.168.1.84","TCP","66","443  >  33458 [ACK] Seq=1 Ack=18707 Win=1979 Len=0 TSval=429376993 TSecr=2665693072"
"134","6.374754475","192.168.1.84","152.67.151.45","TLSv1.2","583","Client Hello"
"135","6.374825863","192.168.1.84","13.248.142.92","TLSv1.2","438","Application Model.Data"
"136","6.376884451","13.248.142.92","192.168.1.84","TCP","66","443  >  33458 [ACK] Seq=1 Ack=18895 Win=1979 Len=0 TSval=429376993 TSecr=2665693072"
"137","6.376884573","13.248.142.92","192.168.1.84","TCP","66","443  >  33458 [ACK] Seq=1 Ack=19121 Win=1979 Len=0 TSval=429376993 TSecr=2665693073"
"138","6.376884615","13.248.142.92","192.168.1.84","TCP","66","443  >  33458 [ACK] Seq=1 Ack=19314 Win=1979 Len=0 TSval=429376993 TSecr=2665693075"
"139","6.378976733","13.248.142.92","192.168.1.84","TCP","66","443  >  33458 [ACK] Seq=1 Ack=22063 Win=1979 Len=0 TSval=429376993 TSecr=2665693075"
"140","6.379608293","192.168.1.84","13.248.142.92","TLSv1.2","414","Application Model.Data"
"141","6.383291844","13.248.142.92","192.168.1.84","TCP","66","443  >  33458 [ACK] Seq=1 Ack=24863 Win=1979 Len=0 TSval=429376994 TSecr=2665693080"
"142","6.383292022","13.248.142.92","192.168.1.84","TCP","66","443  >  33458 [ACK] Seq=1 Ack=25508 Win=1979 Len=0 TSval=429376994 TSecr=2665693080"
"143","6.384101266","192.168.1.84","13.248.142.92","TLSv1.2","253","Application Model.Data"
"144","6.384453050","192.168.1.84","13.248.142.92","TLSv1.2","253","Application Model.Data"
"145","6.384984319","13.248.142.92","192.168.1.84","TCP","66","443  >  33458 [ACK] Seq=1 Ack=25880 Win=1979 Len=0 TSval=429376994 TSecr=2665693082"
"146","6.389273645","13.248.142.92","192.168.1.84","TCP","66","443  >  33458 [ACK] Seq=1 Ack=26228 Win=1979 Len=0 TSval=429376994 TSecr=2665693087"
"147","6.389624704","2001:818:ea8d:1500:9a2:8687:28ad:13a4","2a05:d01c:dc6:4401:3775:b74b:1af3:355b","TCP","1514","42026  >  443 [ACK] Seq=11123 Ack=7313 Win=501 Len=1428 TSval=52109899 TSecr=748154790 [TCP segment of a reassembled PDU]"
"148","6.390428871","192.168.1.1","192.168.1.84","DNS","178","Standard query response 0xd04b AAAA meet-jit-si-turnrelay.jitsi.net SOA ns-1595.awsdns-41.co.uk"
"149","6.390772378","192.168.1.84","10.42.74.105","STUN","146","Binding Request user: 655p21f6s8502i:gfx/"
"150","6.393021831","192.168.1.84","13.248.142.92","TLSv1.2","259","Application Model.Data"
"151","6.393255785","192.168.1.84","13.248.142.92","TLSv1.2","438","Application Model.Data"
"152","6.393779990","13.248.142.92","192.168.1.84","TCP","66","443  >  33458 [ACK] Seq=1 Ack=26415 Win=1979 Len=0 TSval=429376995 TSecr=2665693091"
"153","6.393780168","13.248.142.92","192.168.1.84","TCP","66","443  >  33458 [ACK] Seq=1 Ack=26602 Win=1979 Len=0 TSval=429376995 TSecr=2665693092"
"154","6.394984667","192.168.1.84","13.248.142.92","TLSv1.2","259","Application Model.Data"
"155","6.395665654","192.168.1.84","13.248.142.92","TLSv1.2","414","Application Model.Data"
"156","6.397567167","192.168.1.84","13.248.142.92","TLSv1.2","258","Application Model.Data"
"157","6.398137437","192.168.1.1","192.168.1.84","DNS","420","Standard query response 0xe34f A meet-jit-si-turnrelay.jitsi.net A 193.123.34.138 NS ns-1595.awsdns-07.co.uk NS ns-840.awsdns-41.net NS ns-1039.awsdns-01.org NS ns-271.awsdns-33.com A 205.251.196.15 A 205.251.198.59 A 205.251.193.15 A 205.251.195.72 AAAA 2600:9000:5304:f00::1 AAAA 2600:9000:5306:3b00::1 AAAA 2600:9000:5301:f00::1 AAAA 2600:9000:5303:4800::1"
"158","6.398598485","192.168.1.84","193.123.34.138","STUN","62","Binding Request"
"159","6.399094752","192.168.1.84","193.123.34.138","STUN","70","Allocate Request UDP"
"160","6.399309303","192.168.1.84","192.168.1.1","DNS","91","Standard query 0xe425 A meet-jit-si-turnrelay.jitsi.net"
"161","6.399321005","192.168.1.84","192.168.1.1","DNS","91","Standard query 0xfc21 AAAA meet-jit-si-turnrelay.jitsi.net"
"162","6.400390499","2a05:d01c:dc6:4401:3775:b74b:1af3:355b","2001:818:ea8d:1500:9a2:8687:28ad:13a4","TCP","86","443  >  42026 [ACK] Seq=7313 Ack=3358 Win=206 Len=0 TSval=748154843 TSecr=52109869"
"163","6.400418393","2001:818:ea8d:1500:9a2:8687:28ad:13a4","2a05:d01c:dc6:4401:3775:b74b:1af3:355b","TCP","1514","42026  >  443 [ACK] Seq=12551 Ack=7313 Win=501 Len=1428 TSval=52109909 TSecr=748154843 [TCP segment of a reassembled PDU]"
"164","6.400425931","2001:818:ea8d:1500:9a2:8687:28ad:13a4","2a05:d01c:dc6:4401:3775:b74b:1af3:355b","TCP","1514","42026  >  443 [ACK] Seq=13979 Ack=7313 Win=501 Len=1428 TSval=52109909 TSecr=748154843 [TCP segment of a reassembled PDU]"
"165","6.400427879","2001:818:ea8d:1500:9a2:8687:28ad:13a4","2a05:d01c:dc6:4401:3775:b74b:1af3:355b","TCP","1514","42026  >  443 [ACK] Seq=15407 Ack=7313 Win=501 Len=1428 TSval=52109909 TSecr=748154843 [TCP segment of a reassembled PDU]"
"166","6.400429433","2001:818:ea8d:1500:9a2:8687:28ad:13a4","2a05:d01c:dc6:4401:3775:b74b:1af3:355b","TLSv1.2","560","Application Model.Data"
"167","6.402647740","2a05:d01c:dc6:4401:3775:b74b:1af3:355b","2001:818:ea8d:1500:9a2:8687:28ad:13a4","TCP","86","443  >  42026 [ACK] Seq=7313 Ack=6214 Win=229 Len=0 TSval=748154845 TSecr=52109869"
"168","6.402647978","2a05:d01c:dc6:4401:3775:b74b:1af3:355b","2001:818:ea8d:1500:9a2:8687:28ad:13a4","TCP","86","443  >  42026 [ACK] Seq=7313 Ack=9070 Win=251 Len=0 TSval=748154846 TSecr=52109869"
"169","6.402647999","13.248.142.92","192.168.1.84","TCP","66","443  >  33458 [ACK] Seq=1 Ack=26795 Win=1979 Len=0 TSval=429376996 TSecr=2665693100"
"170","6.402648023","13.248.142.92","192.168.1.84","TCP","66","443  >  33458 [ACK] Seq=1 Ack=27167 Win=1979 Len=0 TSval=429376996 TSecr=2665693100"
"171","6.403728535","192.168.1.1","192.168.1.84","DNS","107","Standard query response 0xe425 A meet-jit-si-turnrelay.jitsi.net A 193.123.34.138"
"172","6.403728680","2a05:d01c:dc6:4401:3775:b74b:1af3:355b","2001:818:ea8d:1500:9a2:8687:28ad:13a4","TCP","86","443  >  42026 [ACK] Seq=7313 Ack=11062 Win=266 Len=0 TSval=748154847 TSecr=52109872"
"173","6.404850223","192.168.1.1","192.168.1.84","DNS","91","Standard query response 0xfc21 AAAA meet-jit-si-turnrelay.jitsi.net"
"174","6.404850262","13.248.142.92","192.168.1.84","TCP","66","443  >  33458 [ACK] Seq=1 Ack=27360 Win=1979 Len=0 TSval=429376996 TSecr=2665693102"
"175","6.405043257","192.168.1.84","193.123.34.138","TCP","74","60438  >  443 [SYN] Seq=0 Win=64240 Len=0 MSS=1460 SACK_PERM=1 TSval=1310425241 TSecr=0 WS=128"
"176","6.405967975","13.248.142.92","192.168.1.84","TCP","66","443  >  33458 [ACK] Seq=1 Ack=27708 Win=1979 Len=0 TSval=429376996 TSecr=2665693103"
"177","6.407108402","13.248.142.92","192.168.1.84","TCP","66","443  >  33458 [ACK] Seq=1 Ack=27900 Win=1979 Len=0 TSval=429376996 TSecr=2665693105"
"178","6.408472309","2a05:d01c:dc6:4401:3775:b74b:1af3:355b","2001:818:ea8d:1500:9a2:8687:28ad:13a4","TLSv1.2","150","Application Model.Data"
"179","6.408504675","2001:818:ea8d:1500:9a2:8687:28ad:13a4","2a05:d01c:dc6:4401:3775:b74b:1af3:355b","TCP","86","42026  >  443 [ACK] Seq=17309 Ack=7377 Win=501 Len=0 TSval=52109918 TSecr=748154851"
"180","6.417501022","152.67.151.45","192.168.1.84","TCP","66","443  >  41230 [ACK] Seq=1 Ack=518 Win=63488 Len=0 TSval=1255420666 TSecr=530678394"
"181","6.425370132","152.67.151.45","192.168.1.84","TCP","2866","443  >  41230 [PSH, ACK] Seq=1 Ack=518 Win=63488 Len=2800 TSval=1255420673 TSecr=530678394 [TCP segment of a reassembled PDU]"
"182","6.425400092","192.168.1.84","152.67.151.45","TCP","66","41230  >  443 [ACK] Seq=518 Ack=2801 Win=61568 Len=0 TSval=530678444 TSecr=1255420673"
"183","6.425370305","152.67.151.45","192.168.1.84","TLSv1.2","543","Server Hello, Certificate, Server Key Exchange, Server Hello Done"
"184","6.425414975","192.168.1.84","152.67.151.45","TCP","66","41230  >  443 [ACK] Seq=518 Ack=3278 Win=61184 Len=0 TSval=530678444 TSecr=1255420673"
"185","6.427759618","192.168.1.84","152.67.151.45","TLSv1.2","159","Client Key Exchange, Change Cipher Spec, Encrypted Handshake Message"
"186","6.427912522","192.168.1.84","193.123.34.138","TCP","74","60440  >  443 [SYN] Seq=0 Win=64240 Len=0 MSS=1460 SACK_PERM=1 TSval=1310425264 TSecr=0 WS=128"
"187","6.438870798","192.168.1.84","152.67.151.45","STUN","146","Binding Request user: 655p21f6s8502i:gfx/"
"188","6.440494493","2a05:d01c:dc6:4401:3775:b74b:1af3:355b","2001:818:ea8d:1500:9a2:8687:28ad:13a4","TCP","86","443  >  42026 [ACK] Seq=7377 Ack=13979 Win=289 Len=0 TSval=748154883 TSecr=52109899"
"189","6.440494621","2a05:d01c:dc6:4401:3775:b74b:1af3:355b","2001:818:ea8d:1500:9a2:8687:28ad:13a4","TCP","86","443  >  42026 [ACK] Seq=7377 Ack=17309 Win=315 Len=0 TSval=748154884 TSecr=52109909"
"190","6.442656529","193.123.34.138","192.168.1.84","STUN","142","Binding Success Response XOR-MAPPED-ADDRESS: 94.61.228.206:54023 MAPPED-ADDRESS: 94.61.228.206:54023 RESPONSE-ORIGIN: 193.123.34.138:443 OTHER-ADDRESS: 193.123.34.138:444"
"191","6.442656665","193.123.34.138","192.168.1.84","STUN","154","Allocate Error Response error-code: 401 (Unauthorized) Unauthorized with nonce realm: coturn.jitsi.net"
"192","6.442938381","192.168.1.84","193.123.34.138","STUN","150","Allocate Request UDP user: 1622384565 realm: coturn.jitsi.net with nonce"
"193","6.443278191","192.168.1.84","13.248.142.92","TLSv1.2","447","Application Model.Data"
"194","6.444696981","2a05:d01c:dc6:4401:3775:b74b:1af3:355b","2001:818:ea8d:1500:9a2:8687:28ad:13a4","TLSv1.2","329","Application Model.Data"
"195","6.444715116","2001:818:ea8d:1500:9a2:8687:28ad:13a4","2a05:d01c:dc6:4401:3775:b74b:1af3:355b","TCP","86","42026  >  443 [ACK] Seq=17309 Ack=7620 Win=500 Len=0 TSval=52109954 TSecr=748154887"
"196","6.451175492","193.123.34.138","192.168.1.84","TCP","74","443  >  60438 [SYN, ACK] Seq=0 Ack=1 Win=62636 Len=0 MSS=1412 SACK_PERM=1 TSval=184393689 TSecr=1310425241 WS=2048"
"197","6.451213550","192.168.1.84","193.123.34.138","TCP","66","60438  >  443 [ACK] Seq=1 Ack=1 Win=64256 Len=0 TSval=1310425287 TSecr=184393689"
"198","6.451388201","192.168.1.84","193.123.34.138","TLSv1.2","583","Client Hello"
"199","6.451453096","192.168.1.84","13.248.142.92","TLSv1.2","450","Application Model.Data"
"200","6.453283807","13.248.142.92","192.168.1.84","TCP","66","443  >  33458 [ACK] Seq=1 Ack=28281 Win=1979 Len=0 TSval=429377001 TSecr=2665693150"
"201","6.454241700","192.168.1.84","13.248.142.92","TLSv1.2","425","Application Model.Data"
"202","6.460989943","13.248.142.92","192.168.1.84","TCP","66","443  >  33458 [ACK] Seq=1 Ack=28665 Win=1979 Len=0 TSval=429377001 TSecr=2665693159"
"203","6.464110125","13.248.142.92","192.168.1.84","TCP","66","443  >  33458 [ACK] Seq=1 Ack=29024 Win=1979 Len=0 TSval=429377002 TSecr=2665693161"
"204","6.469960036","152.67.151.45","192.168.1.84","TCP","66","443  >  41230 [ACK] Seq=3278 Ack=611 Win=63488 Len=0 TSval=1255420718 TSecr=530678447"
"205","6.472129813","152.67.151.45","192.168.1.84","TLSv1.2","72","Change Cipher Spec"
"206","6.472143922","192.168.1.84","152.67.151.45","TCP","66","41230  >  443 [ACK] Seq=611 Ack=3284 Win=64128 Len=0 TSval=530678491 TSecr=1255420721"
"207","6.472129889","152.67.151.45","192.168.1.84","TLSv1.2","111","Encrypted Handshake Message"
"208","6.472162533","192.168.1.84","152.67.151.45","TCP","66","41230  >  443 [ACK] Seq=611 Ack=3329 Win=64128 Len=0 TSval=530678491 TSecr=1255420721"
"209","6.472357856","192.168.1.84","152.67.151.45","TLSv1.2","712","Application Model.Data"
"210","6.473224571","193.123.34.138","192.168.1.84","TCP","74","443  >  60440 [SYN, ACK] Seq=0 Ack=1 Win=62636 Len=0 MSS=1412 SACK_PERM=1 TSval=184393711 TSecr=1310425264 WS=2048"
"211","6.473242190","192.168.1.84","193.123.34.138","TCP","66","60440  >  443 [ACK] Seq=1 Ack=1 Win=64256 Len=0 TSval=1310425309 TSecr=184393711"
"212","6.473352621","192.168.1.84","193.123.34.138","TLSv1.2","583","Client Hello"
"213","6.476289183","192.168.1.84","13.248.142.92","TLSv1.2","450","Application Model.Data"
"214","6.477823106","192.168.1.84","13.248.142.92","TLSv1.2","425","Application Model.Data"
"215","6.482990012","152.67.151.45","192.168.1.84","STUN","146","Binding Success Response XOR-MAPPED-ADDRESS: 94.61.228.206:38829 user: 655p21f6s8502i:gfx/"
"216","6.483465308","192.168.1.84","152.67.151.45","DTLSv1.2","201","Client Hello"
"217","6.483883587","192.168.1.84","13.248.142.92","TLSv1.2","260","Application Model.Data"
"218","6.486123198","13.248.142.92","192.168.1.84","TCP","66","443  >  33458 [ACK] Seq=1 Ack=29408 Win=1979 Len=0 TSval=429377004 TSecr=2665693183"
"219","6.487007332","192.168.1.84","152.67.151.45","STUN","146","Binding Request user: 655p21f6s8502i:gfx/"
"220","6.488244341","13.248.142.92","192.168.1.84","TCP","66","443  >  33458 [ACK] Seq=1 Ack=29767 Win=1979 Len=0 TSval=429377004 TSecr=2665693185"
"221","6.491599005","193.123.34.138","192.168.1.84","STUN","150","Allocate Success Response XOR-RELAYED-ADDRESS: 193.123.34.138:56187 XOR-MAPPED-ADDRESS: 94.61.228.206:54023 lifetime: 600"
"222","6.493803526","13.248.142.92","192.168.1.84","TCP","66","443  >  33458 [ACK] Seq=1 Ack=29961 Win=1979 Len=0 TSval=429377005 TSecr=2665693191"
"223","6.494810452","152.67.151.45","192.168.1.84","STUN","154","Binding Request user: gfx/:655p21f6s8502i"
"224","6.495090232","192.168.1.84","152.67.151.45","STUN","106","Binding Success Response XOR-MAPPED-ADDRESS: 152.67.151.45:10000"
"225","6.496909621","193.123.34.138","192.168.1.84","TCP","66","443  >  60438 [ACK] Seq=1 Ack=518 Win=63488 Len=0 TSval=184393735 TSecr=1310425287"
"226","6.498131897","193.123.34.138","192.168.1.84","TLSv1.2","3334","Server Hello, Certificate, Server Key Exchange, Server Hello Done"
"227","6.498148939","192.168.1.84","193.123.34.138","TCP","66","60438  >  443 [ACK] Seq=518 Ack=3269 Win=61056 Len=0 TSval=1310425334 TSecr=184393736"
"228","6.498563149","192.168.1.84","193.123.34.138","TLSv1.2","159","Client Key Exchange, Change Cipher Spec, Encrypted Handshake Message"
"229","6.502381819","192.168.1.84","13.248.142.92","TCP","1466","33458  >  443 [ACK] Seq=29961 Ack=1 Win=501 Len=1400 TSval=2665693209 TSecr=429377005 [TCP segment of a reassembled PDU]"
"230","6.502400779","192.168.1.84","13.248.142.92","TCP","1466","33458  >  443 [ACK] Seq=31361 Ack=1 Win=501 Len=1400 TSval=2665693209 TSecr=429377005 [TCP segment of a reassembled PDU]"
"231","6.502403481","192.168.1.84","13.248.142.92","TCP","1466","33458  >  443 [ACK] Seq=32761 Ack=1 Win=501 Len=1400 TSval=2665693209 TSecr=429377005 [TCP segment of a reassembled PDU]"
"232","6.502405746","192.168.1.84","13.248.142.92","TCP","1466","33458  >  443 [ACK] Seq=34161 Ack=1 Win=501 Len=1400 TSval=2665693209 TSecr=429377005 [TCP segment of a reassembled PDU]"
"233","6.502408006","192.168.1.84","13.248.142.92","TCP","1466","33458  >  443 [ACK] Seq=35561 Ack=1 Win=501 Len=1400 TSval=2665693209 TSecr=429377005 [TCP segment of a reassembled PDU]"
"234","6.502410144","192.168.1.84","13.248.142.92","TCP","1466","33458  >  443 [ACK] Seq=36961 Ack=1 Win=501 Len=1400 TSval=2665693209 TSecr=429377005 [TCP segment of a reassembled PDU]"
"235","6.502412048","192.168.1.84","13.248.142.92","TLSv1.2","390","Application Model.Data"
"236","6.504506153","192.168.1.84","13.248.142.92","TLSv1.2","447","Application Model.Data"
"237","6.506262027","192.168.1.84","13.248.142.92","TLSv1.2","258","Application Model.Data"
"238","6.506535399","192.168.1.84","13.248.142.92","TLSv1.2","239","Application Model.Data"
"239","6.512815447","13.248.142.92","192.168.1.84","TCP","66","443  >  33458 [ACK] Seq=1 Ack=32761 Win=1979 Len=0 TSval=429377006 TSecr=2665693209"
"240","6.512815627","13.248.142.92","192.168.1.84","TCP","66","443  >  33458 [ACK] Seq=1 Ack=35561 Win=1979 Len=0 TSval=429377006 TSecr=2665693209"
"241","6.512815656","13.248.142.92","192.168.1.84","TCP","66","443  >  33458 [ACK] Seq=1 Ack=38361 Win=1979 Len=0 TSval=429377006 TSecr=2665693209"
"242","6.512815679","13.248.142.92","192.168.1.84","TCP","66","443  >  33458 [ACK] Seq=1 Ack=38685 Win=1979 Len=0 TSval=429377006 TSecr=2665693209"
"243","6.515124180","152.67.151.45","192.168.1.84","TCP","66","443  >  41230 [ACK] Seq=3329 Ack=1257 Win=63488 Len=0 TSval=1255420763 TSecr=530678491"
"244","6.515124251","13.248.142.92","192.168.1.84","TCP","66","443  >  33458 [ACK] Seq=1 Ack=39066 Win=1979 Len=0 TSval=429377007 TSecr=2665693212"
"245","6.515124275","13.248.142.92","192.168.1.84","TCP","66","443  >  33458 [ACK] Seq=1 Ack=39258 Win=1979 Len=0 TSval=429377007 TSecr=2665693213"
"246","6.515968170","152.67.151.45","192.168.1.84","TLSv1.2","340","Application Model.Data"
"247","6.515982788","192.168.1.84","152.67.151.45","TCP","66","41230  >  443 [ACK] Seq=1257 Ack=3603 Win=63872 Len=0 TSval=530678535 TSecr=1255420765"
"248","6.515969565","13.248.142.92","192.168.1.84","TCP","66","443  >  33458 [ACK] Seq=1 Ack=39431 Win=1979 Len=0 TSval=429377007 TSecr=2665693214"
"249","6.515969608","152.67.151.45","192.168.1.84","TLSv1.2","157","Application Model.Data"
"250","6.516005374","192.168.1.84","152.67.151.45","TCP","66","41230  >  443 [ACK] Seq=1257 Ack=3694 Win=63872 Len=0 TSval=530678535 TSecr=1255420765"
"251","6.515969634","152.67.151.45","192.168.1.84","TLSv1.2","149","Application Model.Data"
"252","6.516011293","192.168.1.84","152.67.151.45","TCP","66","41230  >  443 [ACK] Seq=1257 Ack=3777 Win=63872 Len=0 TSval=530678535 TSecr=1255420765"
"253","6.515969659","152.67.151.45","192.168.1.84","TLSv1.2","177","Application Model.Data"
"254","6.516016395","192.168.1.84","152.67.151.45","TCP","66","41230  >  443 [ACK] Seq=1257 Ack=3888 Win=63872 Len=0 TSval=530678535 TSecr=1255420765"
"255","6.519120923","193.123.34.138","192.168.1.84","TCP","66","443  >  60440 [ACK] Seq=1 Ack=518 Win=63488 Len=0 TSval=184393757 TSecr=1310425309"
"256","6.519313518","192.168.1.84","152.67.151.45","TLSv1.2","238","Application Model.Data"
"257","6.519979926","192.168.1.84","152.67.151.45","TLSv1.2","134","Application Model.Data"
"258","6.520576140","193.123.34.138","192.168.1.84","TLSv1.2","3334","Server Hello, Certificate, Server Key Exchange, Server Hello Done"
"259","6.520612221","192.168.1.84","193.123.34.138","TCP","66","60440  >  443 [ACK] Seq=518 Ack=3269 Win=61056 Len=0 TSval=1310425357 TSecr=184393758"
"260","6.521278977","192.168.1.84","193.123.34.138","TLSv1.2","159","Client Key Exchange, Change Cipher Spec, Encrypted Handshake Message"
"261","6.528893870","152.67.151.45","192.168.1.84","STUN","146","Binding Success Response XOR-MAPPED-ADDRESS: 94.61.228.206:38829 user: 655p21f6s8502i:gfx/"
"262","6.529749022","2001:818:ea8d:1500:9a2:8687:28ad:13a4","2a05:d01c:dc6:4401:3775:b74b:1af3:355b","TLSv1.2","293","Application Model.Data"
"263","6.535191126","192.168.1.84","152.67.151.45","STUN","146","Binding Request user: 655p21f6s8502i:gfx/"
"264","6.535247415","152.67.151.45","192.168.1.84","STUN","154","Binding Request user: gfx/:655p21f6s8502i"
"265","6.535419571","192.168.1.84","152.67.151.45","STUN","106","Binding Success Response XOR-MAPPED-ADDRESS: 152.67.151.45:10000"
"266","6.542434820","2001:818:ea8d:1500:9a2:8687:28ad:13a4","2a05:d01c:dc6:4401:3775:b74b:1af3:355b","TCP","1514","42026  >  443 [ACK] Seq=17516 Ack=7620 Win=501 Len=1428 TSval=52110051 TSecr=748154887 [TCP segment of a reassembled PDU]"
"267","6.542464454","2001:818:ea8d:1500:9a2:8687:28ad:13a4","2a05:d01c:dc6:4401:3775:b74b:1af3:355b","TLSv1.2","547","Application Model.Data"
"268","6.543271915","152.67.151.45","192.168.1.84","STUN","158","Binding Request user: gfx/:655p21f6s8502i"
"269","6.543704333","192.168.1.84","152.67.151.45","STUN","106","Binding Success Response XOR-MAPPED-ADDRESS: 152.67.151.45:10000"
"270","6.545508651","193.123.34.138","192.168.1.84","TLSv1.2","292","New Session Ticket, Change Cipher Spec, Encrypted Handshake Message"
"271","6.545618658","192.168.1.84","193.123.34.138","TCP","66","60438  >  443 [ACK] Seq=611 Ack=3495 Win=64000 Len=0 TSval=1310425382 TSecr=184393782"
"272","6.546373950","192.168.1.84","193.123.34.138","TLSv1.2","123","Application Model.Data"
"273","6.548886847","2001:818:ea8d:1500:9a2:8687:28ad:13a4","2a05:d01c:dc6:4401:3775:b74b:1af3:355b","TCP","1514","42026  >  443 [ACK] Seq=19405 Ack=7620 Win=501 Len=1428 TSval=52110058 TSecr=748154887 [TCP segment of a reassembled PDU]"
"274","6.548901883","2001:818:ea8d:1500:9a2:8687:28ad:13a4","2a05:d01c:dc6:4401:3775:b74b:1af3:355b","TLSv1.2","110","Application Model.Data"
