"No.","Time","Source","Destination","Protocol","Length","Info"
"1","0.000000","PtInovac_35:65:2f","Spanning-tree-(for-bridges)_00","STP","60","Conf. Root = 32768/0/00:06:91:35:65:2f  Cost = 0  Port = 0x8001"
"2","0.229506","192.168.1.71","239.255.255.250","UDP","501","1065  >  8082 Len=459"
"3","1.211511","192.168.1.69","239.255.255.250","UDP","501","1069  >  8082 Len=459"
"4","2.000014","PtInovac_35:65:2f","Spanning-tree-(for-bridges)_00","STP","60","Conf. Root = 32768/0/00:06:91:35:65:2f  Cost = 0  Port = 0x8001"
"5","2.143025","2a00:1450:4003:807::200a","2001:8a0:fe07:7800:bd1e:7fb5:db2:f993","TLSv1.2","159","Application Data"
"6","2.143270","2001:8a0:fe07:7800:bd1e:7fb5:db2:f993","2a00:1450:4003:807::200a","TCP","86","49310  >  443 [ACK] Seq=1 Ack=74 Win=2048 Len=0 TSval=937429556 TSecr=2028151991"
"7","2.143358","2001:8a0:fe07:7800:bd1e:7fb5:db2:f993","2a00:1450:4003:807::200a","TCP","86","49310  >  443 [FIN, ACK] Seq=1 Ack=74 Win=2048 Len=0 TSval=937429556 TSecr=2028151991"
"8","2.161798","2a00:1450:4003:807::200a","2001:8a0:fe07:7800:bd1e:7fb5:db2:f993","TCP","86","443  >  49310 [FIN, ACK] Seq=74 Ack=2 Win=290 Len=0 TSval=2028152009 TSecr=937429556"
"9","2.161912","2001:8a0:fe07:7800:bd1e:7fb5:db2:f993","2a00:1450:4003:807::200a","TCP","86","49310  >  443 [ACK] Seq=2 Ack=75 Win=2048 Len=0 TSval=937429574 TSecr=2028152009"
"10","2.845921","2001:8a0:fe07:7800:bd1e:7fb5:db2:f993","2a05:d01c:dc6:4402:61f3:ef98:4edd:cda4","TCP","74","49350  >  443 [ACK] Seq=1 Ack=1 Win=2070 Len=0"
"11","2.892533","2a05:d01c:dc6:4402:61f3:ef98:4edd:cda4","2001:8a0:fe07:7800:bd1e:7fb5:db2:f993","TCP","86","[TCP ACKed unseen segment] 443  >  49350 [ACK] Seq=1 Ack=2 Win=127 Len=0 TSval=3727856471 TSecr=937385171"
"12","3.229700","192.168.1.71","239.255.255.250","UDP","501","1065  >  8082 Len=459"
"13","4.000486","PtInovac_35:65:2f","Spanning-tree-(for-bridges)_00","STP","60","Conf. Root = 32768/0/00:06:91:35:65:2f  Cost = 0  Port = 0x8001"
"14","4.211547","192.168.1.69","239.255.255.250","UDP","501","1069  >  8082 Len=459"
"15","4.592315","fe80::206:91ff:fe35:652f","ff02::1","ICMPv6","134","Router Advertisement from 00:06:91:35:65:2f"
"16","5.531084","2a05:d01c:dc6:4402:61f3:ef98:4edd:cda4","2001:8a0:fe07:7800:bd1e:7fb5:db2:f993","TLSv1.2","1068","Application Data"
"17","5.531159","2001:8a0:fe07:7800:bd1e:7fb5:db2:f993","2a05:d01c:dc6:4402:61f3:ef98:4edd:cda4","TCP","86","49353  >  443 [ACK] Seq=1 Ack=983 Win=2032 Len=0 TSval=937432939 TSecr=3727859110"
"18","5.534674","2a05:d01c:dc6:4402:61f3:ef98:4edd:cda4","2001:8a0:fe07:7800:bd1e:7fb5:db2:f993","TLSv1.2","918","Application Data"
"19","5.534730","2001:8a0:fe07:7800:bd1e:7fb5:db2:f993","2a05:d01c:dc6:4402:61f3:ef98:4edd:cda4","TCP","86","49353  >  443 [ACK] Seq=1 Ack=1815 Win=2035 Len=0 TSval=937432942 TSecr=3727859112"
"20","5.554714","2a05:d01c:dc6:4402:61f3:ef98:4edd:cda4","2001:8a0:fe07:7800:bd1e:7fb5:db2:f993","TCP","1514","443  >  49353 [ACK] Seq=1815 Ack=1 Win=186 Len=1428 TSval=3727859133 TSecr=937414093 [TCP segment of a reassembled PDU]"
"21","5.554792","2001:8a0:fe07:7800:bd1e:7fb5:db2:f993","2a05:d01c:dc6:4402:61f3:ef98:4edd:cda4","TCP","86","49353  >  443 [ACK] Seq=1 Ack=3243 Win=2025 Len=0 TSval=937432962 TSecr=3727859133"
"22","5.554877","2a05:d01c:dc6:4402:61f3:ef98:4edd:cda4","2001:8a0:fe07:7800:bd1e:7fb5:db2:f993","TCP","1514","443  >  49353 [ACK] Seq=3243 Ack=1 Win=186 Len=1428 TSval=3727859133 TSecr=937414093 [TCP segment of a reassembled PDU]"
"23","5.554922","2001:8a0:fe07:7800:bd1e:7fb5:db2:f993","2a05:d01c:dc6:4402:61f3:ef98:4edd:cda4","TCP","86","49353  >  443 [ACK] Seq=1 Ack=4671 Win=2025 Len=0 TSval=937432962 TSecr=3727859133"
"24","5.554931","2a05:d01c:dc6:4402:61f3:ef98:4edd:cda4","2001:8a0:fe07:7800:bd1e:7fb5:db2:f993","TCP","1514","443  >  49353 [ACK] Seq=4671 Ack=1 Win=186 Len=1428 TSval=3727859133 TSecr=937414093 [TCP segment of a reassembled PDU]"
"25","5.554966","2001:8a0:fe07:7800:bd1e:7fb5:db2:f993","2a05:d01c:dc6:4402:61f3:ef98:4edd:cda4","TCP","86","49353  >  443 [ACK] Seq=1 Ack=6099 Win=2025 Len=0 TSval=937432962 TSecr=3727859133"
"26","5.555510","2a05:d01c:dc6:4402:61f3:ef98:4edd:cda4","2001:8a0:fe07:7800:bd1e:7fb5:db2:f993","TLSv1.2","1030","Application Data"
"27","5.555544","2001:8a0:fe07:7800:bd1e:7fb5:db2:f993","2a05:d01c:dc6:4402:61f3:ef98:4edd:cda4","TCP","86","49353  >  443 [ACK] Seq=1 Ack=7043 Win=2033 Len=0 TSval=937432962 TSecr=3727859133"
"28","5.583144","192.168.1.79","76.223.9.91","TLSv1.2","571","Application Data"
"29","5.583160","192.168.1.79","76.223.9.91","TLSv1.2","344","Application Data"
"30","5.593836","76.223.9.91","192.168.1.79","TCP","66","443  >  49359 [ACK] Seq=1 Ack=506 Win=1979 Len=0 TSval=81142259 TSecr=937432990"
"31","5.593837","76.223.9.91","192.168.1.79","TCP","66","443  >  49359 [ACK] Seq=1 Ack=784 Win=1979 Len=0 TSval=81142259 TSecr=937432990"
"32","5.610700","192.168.1.79","76.223.9.91","TLSv1.2","313","Application Data"
"33","5.612371","192.168.1.79","76.223.9.91","TLSv1.2","291","Application Data"
"34","5.619980","76.223.9.91","192.168.1.79","TCP","66","443  >  49359 [ACK] Seq=1 Ack=1031 Win=1979 Len=0 TSval=81142262 TSecr=937433016"
"35","5.621964","76.223.9.91","192.168.1.79","TCP","66","443  >  49359 [ACK] Seq=1 Ack=1256 Win=1979 Len=0 TSval=81142262 TSecr=937433017"
"36","5.655488","192.168.1.79","76.223.9.91","TLSv1.2","431","Application Data"
"37","5.655505","192.168.1.79","76.223.9.91","TLSv1.2","345","Application Data"
"38","5.658122","2001:8a0:fe07:7800:bd1e:7fb5:db2:f993","2001:8a0:fe07:7800::1","DNS","130","Standard query 0x8e0f A meet-jit-si-eu-west-2a-s46-jvb-42-81-213.jitsi.net"
"39","5.658258","2001:8a0:fe07:7800:bd1e:7fb5:db2:f993","2001:8a0:fe07:7800::1","DNS","130","Standard query 0x4529 AAAA meet-jit-si-eu-west-2a-s46-jvb-42-81-213.jitsi.net"
"40","5.658428","2001:8a0:fe07:7800:bd1e:7fb5:db2:f993","2a05:d01c:dc6:4402:61f3:ef98:4edd:cda4","TLSv1.2","345","Application Data"
"41","5.663351","192.168.1.79","76.223.9.91","TLSv1.2","244","Application Data"
"42","5.665476","192.168.1.79","76.223.9.91","TCP","1514","49359  >  443 [ACK] Seq=2078 Ack=1 Win=2048 Len=1448 TSval=937433066 TSecr=81142262 [TCP segment of a reassembled PDU]"
"43","5.665483","192.168.1.79","76.223.9.91","TCP","1514","49359  >  443 [ACK] Seq=3526 Ack=1 Win=2048 Len=1448 TSval=937433066 TSecr=81142262 [TCP segment of a reassembled PDU]"
"44","5.665484","192.168.1.79","76.223.9.91","TCP","1514","49359  >  443 [ACK] Seq=4974 Ack=1 Win=2048 Len=1448 TSval=937433066 TSecr=81142262 [TCP segment of a reassembled PDU]"
"45","5.665486","192.168.1.79","76.223.9.91","TCP","1514","49359  >  443 [ACK] Seq=6422 Ack=1 Win=2048 Len=1448 TSval=937433066 TSecr=81142262 [TCP segment of a reassembled PDU]"
"46","5.665487","192.168.1.79","76.223.9.91","TLSv1.2","315","Application Data"
"47","5.667323","76.223.9.91","192.168.1.79","TCP","66","443  >  49359 [ACK] Seq=1 Ack=1621 Win=1979 Len=0 TSval=81142266 TSecr=937433058"
"48","5.667324","76.223.9.91","192.168.1.79","TCP","66","443  >  49359 [ACK] Seq=1 Ack=1900 Win=1979 Len=0 TSval=81142266 TSecr=937433058"
"49","5.673611","192.168.1.79","76.223.9.91","TCP","1514","49359  >  443 [ACK] Seq=8119 Ack=1 Win=2048 Len=1448 TSval=937433073 TSecr=81142266 [TCP segment of a reassembled PDU]"
"50","5.673616","192.168.1.79","76.223.9.91","TCP","1514","49359  >  443 [ACK] Seq=9567 Ack=1 Win=2048 Len=1448 TSval=937433073 TSecr=81142266 [TCP segment of a reassembled PDU]"
"51","5.673617","192.168.1.79","76.223.9.91","TCP","1514","49359  >  443 [ACK] Seq=11015 Ack=1 Win=2048 Len=1448 TSval=937433073 TSecr=81142266 [TCP segment of a reassembled PDU]"
"52","5.673618","192.168.1.79","76.223.9.91","TCP","1514","49359  >  443 [ACK] Seq=12463 Ack=1 Win=2048 Len=1448 TSval=937433073 TSecr=81142266 [TCP segment of a reassembled PDU]"
"53","5.673619","192.168.1.79","76.223.9.91","TLSv1.2","314","Application Data"
"54","5.674384","76.223.9.91","192.168.1.79","TCP","66","443  >  49359 [ACK] Seq=1 Ack=2078 Win=1979 Len=0 TSval=81142267 TSecr=937433064"
"55","5.675994","192.168.1.79","76.223.9.91","TLSv1.2","313","Application Data"
"56","5.676677","76.223.9.91","192.168.1.79","TCP","66","443  >  49359 [ACK] Seq=1 Ack=3526 Win=1979 Len=0 TSval=81142267 TSecr=937433066"
"57","5.676677","76.223.9.91","192.168.1.79","TCP","66","443  >  49359 [ACK] Seq=1 Ack=4974 Win=1979 Len=0 TSval=81142267 TSecr=937433066"
"58","5.676678","76.223.9.91","192.168.1.79","TCP","66","443  >  49359 [ACK] Seq=1 Ack=6422 Win=1979 Len=0 TSval=81142267 TSecr=937433066"
"59","5.676678","76.223.9.91","192.168.1.79","TCP","66","443  >  49359 [ACK] Seq=1 Ack=7870 Win=1979 Len=0 TSval=81142268 TSecr=937433066"
"60","5.676679","76.223.9.91","192.168.1.79","TCP","66","443  >  49359 [ACK] Seq=1 Ack=8119 Win=1979 Len=0 TSval=81142268 TSecr=937433066"
"61","5.685071","192.168.1.79","76.223.9.91","TCP","1514","49359  >  443 [ACK] Seq=14406 Ack=1 Win=2048 Len=1448 TSval=937433084 TSecr=81142268 [TCP segment of a reassembled PDU]"
"62","5.685076","192.168.1.79","76.223.9.91","TLSv1.2","1233","Application Data"
"63","5.685154","76.223.9.91","192.168.1.79","TCP","66","443  >  49359 [ACK] Seq=1 Ack=9567 Win=1979 Len=0 TSval=81142268 TSecr=937433073"
"64","5.685155","76.223.9.91","192.168.1.79","TCP","66","443  >  49359 [ACK] Seq=1 Ack=11015 Win=1979 Len=0 TSval=81142268 TSecr=937433073"
"65","5.685155","76.223.9.91","192.168.1.79","TCP","66","443  >  49359 [ACK] Seq=1 Ack=12463 Win=1979 Len=0 TSval=81142268 TSecr=937433073"
"66","5.685156","76.223.9.91","192.168.1.79","TCP","66","443  >  49359 [ACK] Seq=1 Ack=13911 Win=1979 Len=0 TSval=81142268 TSecr=937433073"
"67","5.685156","76.223.9.91","192.168.1.79","TCP","66","443  >  49359 [ACK] Seq=1 Ack=14159 Win=1979 Len=0 TSval=81142268 TSecr=937433073"
"68","5.688921","192.168.1.79","76.223.9.91","TLSv1.2","263","Application Data"
"69","5.688982","192.168.1.79","76.223.9.91","TLSv1.2","253","Application Data"
"70","5.689248","76.223.9.91","192.168.1.79","TCP","66","443  >  49359 [ACK] Seq=1 Ack=14406 Win=1979 Len=0 TSval=81142269 TSecr=937433075"
"71","5.696058","76.223.9.91","192.168.1.79","TCP","66","443  >  49359 [ACK] Seq=1 Ack=17021 Win=1979 Len=0 TSval=81142269 TSecr=937433084"
"72","5.698542","2001:8a0:fe07:7800:bd1e:7fb5:db2:f993","2a05:d01c:dc6:4402:61f3:ef98:4edd:cda4","TCP","1514","49353  >  443 [ACK] Seq=260 Ack=7043 Win=2048 Len=1428 TSval=937433096 TSecr=3727859133 [TCP segment of a reassembled PDU]"
"73","5.698549","2001:8a0:fe07:7800:bd1e:7fb5:db2:f993","2a05:d01c:dc6:4402:61f3:ef98:4edd:cda4","TCP","1514","49353  >  443 [ACK] Seq=1688 Ack=7043 Win=2048 Len=1428 TSval=937433096 TSecr=3727859133 [TCP segment of a reassembled PDU]"
"74","5.698550","2001:8a0:fe07:7800:bd1e:7fb5:db2:f993","2a05:d01c:dc6:4402:61f3:ef98:4edd:cda4","TCP","1514","49353  >  443 [ACK] Seq=3116 Ack=7043 Win=2048 Len=1428 TSval=937433096 TSecr=3727859133 [TCP segment of a reassembled PDU]"
"75","5.698551","2001:8a0:fe07:7800:bd1e:7fb5:db2:f993","2a05:d01c:dc6:4402:61f3:ef98:4edd:cda4","TCP","1514","49353  >  443 [ACK] Seq=4544 Ack=7043 Win=2048 Len=1428 TSval=937433096 TSecr=3727859133 [TCP segment of a reassembled PDU]"
"76","5.698552","2001:8a0:fe07:7800:bd1e:7fb5:db2:f993","2a05:d01c:dc6:4402:61f3:ef98:4edd:cda4","TCP","1514","49353  >  443 [ACK] Seq=5972 Ack=7043 Win=2048 Len=1428 TSval=937433096 TSecr=3727859133 [TCP segment of a reassembled PDU]"
"77","5.698553","2001:8a0:fe07:7800:bd1e:7fb5:db2:f993","2a05:d01c:dc6:4402:61f3:ef98:4edd:cda4","TCP","1514","49353  >  443 [ACK] Seq=7400 Ack=7043 Win=2048 Len=1428 TSval=937433096 TSecr=3727859133 [TCP segment of a reassembled PDU]"
"78","5.698554","2001:8a0:fe07:7800:bd1e:7fb5:db2:f993","2a05:d01c:dc6:4402:61f3:ef98:4edd:cda4","TCP","1514","49353  >  443 [ACK] Seq=8828 Ack=7043 Win=2048 Len=1428 TSval=937433096 TSecr=3727859133 [TCP segment of a reassembled PDU]"
"79","5.698555","2001:8a0:fe07:7800:bd1e:7fb5:db2:f993","2a05:d01c:dc6:4402:61f3:ef98:4edd:cda4","TCP","1514","49353  >  443 [ACK] Seq=10256 Ack=7043 Win=2048 Len=1428 TSval=937433096 TSecr=3727859133 [TCP segment of a reassembled PDU]"
"80","5.698556","2001:8a0:fe07:7800:bd1e:7fb5:db2:f993","2a05:d01c:dc6:4402:61f3:ef98:4edd:cda4","TLSv1.2","505","Application Data"
"81","5.701347","76.223.9.91","192.168.1.79","TCP","66","443  >  49359 [ACK] Seq=1 Ack=17405 Win=1979 Len=0 TSval=81142270 TSecr=937433087"
"82","5.704204","2a05:d01c:dc6:4402:61f3:ef98:4edd:cda4","2001:8a0:fe07:7800:bd1e:7fb5:db2:f993","TCP","86","443  >  49353 [ACK] Seq=7043 Ack=260 Win=192 Len=0 TSval=3727859282 TSecr=937433060"
"83","5.705133","192.168.1.79","76.223.9.91","TLSv1.2","244","Application Data"
"84","5.705659","2001:8a0:fe07:7800::1","2001:8a0:fe07:7800:bd1e:7fb5:db2:f993","DNS","146","Standard query response 0x8e0f A meet-jit-si-eu-west-2a-s46-jvb-42-81-213.jitsi.net A 132.145.26.73"
"85","5.710245","192.168.1.79","76.223.9.91","TLSv1.2","264","Application Data"
"86","5.710411","192.168.1.79","76.223.9.91","TLSv1.2","294","Application Data"
"87","5.710892","192.168.1.79","76.223.9.91","TLSv1.2","274","Application Data"
"88","5.710938","192.168.1.79","76.223.9.91","TLSv1.2","274","Application Data"
"89","5.710977","192.168.1.79","76.223.9.91","TLSv1.2","254","Application Data"
"90","5.711263","192.168.1.79","76.223.9.91","TLSv1.2","292","Application Data"
"91","5.711960","192.168.1.79","76.223.9.91","TLSv1.2","259","Application Data"
"92","5.713132","2001:8a0:fe07:7800:bd1e:7fb5:db2:f993","2001:8a0:fe07:7800::1","DNS","111","Standard query 0xac9d A meet-jit-si-turnrelay.jitsi.net"
"93","5.713226","2001:8a0:fe07:7800:bd1e:7fb5:db2:f993","2001:8a0:fe07:7800::1","DNS","111","Standard query 0x9179 AAAA meet-jit-si-turnrelay.jitsi.net"
"94","5.713453","192.168.1.79","76.223.9.91","TLSv1.2","423","Application Data"
"95","5.715686","76.223.9.91","192.168.1.79","TCP","66","443  >  49359 [ACK] Seq=1 Ack=17583 Win=1979 Len=0 TSval=81142271 TSecr=937433100"
"96","5.717216","192.168.1.79","76.223.9.91","TLSv1.2","396","Application Data"
"97","5.720438","76.223.9.91","192.168.1.79","TCP","66","443  >  49359 [ACK] Seq=1 Ack=17781 Win=1979 Len=0 TSval=81142272 TSecr=937433105"
"98","5.720439","76.223.9.91","192.168.1.79","TCP","66","443  >  49359 [ACK] Seq=1 Ack=18009 Win=1979 Len=0 TSval=81142272 TSecr=937433105"
"99","5.721216","192.168.1.79","76.223.9.91","TCP","1514","49359  >  443 [ACK] Seq=19719 Ack=1 Win=2048 Len=1448 TSval=937433114 TSecr=81142272 [TCP segment of a reassembled PDU]"
"100","5.721220","192.168.1.79","76.223.9.91","TLSv1.2","722","Application Data"
"101","5.722004","76.223.9.91","192.168.1.79","TCP","66","443  >  49359 [ACK] Seq=1 Ack=18217 Win=1979 Len=0 TSval=81142272 TSecr=937433105"
"102","5.722004","76.223.9.91","192.168.1.79","TCP","66","443  >  49359 [ACK] Seq=1 Ack=18613 Win=1979 Len=0 TSval=81142272 TSecr=937433105"
"103","5.722005","76.223.9.91","192.168.1.79","TCP","66","443  >  49359 [ACK] Seq=1 Ack=18839 Win=1979 Len=0 TSval=81142272 TSecr=937433106"
"104","5.722005","76.223.9.91","192.168.1.79","TCP","66","443  >  49359 [ACK] Seq=1 Ack=19032 Win=1979 Len=0 TSval=81142272 TSecr=937433106"
"105","5.723568","192.168.1.79","76.223.9.91","TCP","1514","49359  >  443 [ACK] Seq=21823 Ack=1 Win=2048 Len=1448 TSval=937433116 TSecr=81142272 [TCP segment of a reassembled PDU]"
"106","5.723574","192.168.1.79","76.223.9.91","TLSv1.2","720","Application Data"
"107","5.724078","76.223.9.91","192.168.1.79","TCP","66","443  >  49359 [ACK] Seq=1 Ack=19389 Win=1979 Len=0 TSval=81142272 TSecr=937433108"
"108","5.727084","76.223.9.91","192.168.1.79","TCP","66","443  >  49359 [ACK] Seq=1 Ack=19719 Win=1979 Len=0 TSval=81142273 TSecr=937433111"
"109","5.727972","192.168.1.79","76.223.9.91","TLSv1.2","253","Application Data"
"110","5.728059","192.168.1.79","76.223.9.91","TLSv1.2","253","Application Data"
"111","5.730860","2001:8a0:fe07:7800:bd1e:7fb5:db2:f993","2a05:d01c:dc6:4402:61f3:ef98:4edd:cda4","TCP","1514","49353  >  443 [ACK] Seq=12103 Ack=7043 Win=2048 Len=1428 TSval=937433122 TSecr=3727859282 [TCP segment of a reassembled PDU]"
"112","5.730865","2001:8a0:fe07:7800:bd1e:7fb5:db2:f993","2a05:d01c:dc6:4402:61f3:ef98:4edd:cda4","TCP","1514","49353  >  443 [ACK] Seq=13531 Ack=7043 Win=2048 Len=1428 TSval=937433122 TSecr=3727859282 [TCP segment of a reassembled PDU]"
"113","5.730866","2001:8a0:fe07:7800:bd1e:7fb5:db2:f993","2a05:d01c:dc6:4402:61f3:ef98:4edd:cda4","TLSv1.2","533","Application Data"
"114","5.731200","192.168.1.79","76.223.9.91","TLSv1.2","259","Application Data"
"115","5.731616","192.168.1.79","76.223.9.91","TLSv1.2","423","Application Data"
"116","5.731828","192.168.1.79","10.42.81.213","STUN","146","Binding Request user: 2j9qv1f6u9pgf0:pPKX"
"117","5.732797","192.168.1.79","76.223.9.91","TLSv1.2","259","Application Data"
"118","5.733482","192.168.1.79","76.223.9.91","TLSv1.2","396","Application Data"
"119","5.733628","76.223.9.91","192.168.1.79","TCP","66","443  >  49359 [ACK] Seq=1 Ack=21823 Win=1979 Len=0 TSval=81142273 TSecr=937433114"
"120","5.733629","2001:8a0:fe07:7800::1","2001:8a0:fe07:7800:bd1e:7fb5:db2:f993","DNS","127","Standard query response 0xac9d A meet-jit-si-turnrelay.jitsi.net A 193.123.60.145"
"121","5.733629","76.223.9.91","192.168.1.79","TCP","66","443  >  49359 [ACK] Seq=1 Ack=23925 Win=1979 Len=0 TSval=81142273 TSecr=937433116"
"122","5.734573","192.168.1.79","76.223.9.91","TLSv1.2","258","Application Data"
"123","5.737040","76.223.9.91","192.168.1.79","TCP","66","443  >  49359 [ACK] Seq=1 Ack=24112 Win=1979 Len=0 TSval=81142274 TSecr=937433119"
"124","5.740683","76.223.9.91","192.168.1.79","TCP","66","443  >  49359 [ACK] Seq=1 Ack=24299 Win=1979 Len=0 TSval=81142274 TSecr=937433119"
"125","5.743963","76.223.9.91","192.168.1.79","TCP","66","443  >  49359 [ACK] Seq=1 Ack=25372 Win=1979 Len=0 TSval=81142274 TSecr=937433122"
"126","5.743963","76.223.9.91","192.168.1.79","TCP","66","443  >  49359 [ACK] Seq=1 Ack=25564 Win=1979 Len=0 TSval=81142274 TSecr=937433124"
"127","5.743964","2a05:d01c:dc6:4402:61f3:ef98:4edd:cda4","2001:8a0:fe07:7800:bd1e:7fb5:db2:f993","TCP","86","443  >  49353 [ACK] Seq=7043 Ack=1688 Win=203 Len=0 TSval=3727859323 TSecr=937433096"
"128","5.747082","2a05:d01c:dc6:4402:61f3:ef98:4edd:cda4","2001:8a0:fe07:7800:bd1e:7fb5:db2:f993","TCP","86","443  >  49353 [ACK] Seq=7043 Ack=3116 Win=214 Len=0 TSval=3727859324 TSecr=937433096"
"129","5.747083","2a05:d01c:dc6:4402:61f3:ef98:4edd:cda4","2001:8a0:fe07:7800:bd1e:7fb5:db2:f993","TCP","86","443  >  49353 [ACK] Seq=7043 Ack=5972 Win=236 Len=0 TSval=3727859325 TSecr=937433096"
"130","5.747084","2a05:d01c:dc6:4402:61f3:ef98:4edd:cda4","2001:8a0:fe07:7800:bd1e:7fb5:db2:f993","TCP","86","443  >  49353 [ACK] Seq=7043 Ack=7400 Win=248 Len=0 TSval=3727859325 TSecr=937433096"
"131","5.747085","2a05:d01c:dc6:4402:61f3:ef98:4edd:cda4","2001:8a0:fe07:7800:bd1e:7fb5:db2:f993","TCP","86","443  >  49353 [ACK] Seq=7043 Ack=10256 Win=270 Len=0 TSval=3727859325 TSecr=937433096"
"132","5.748549","2a05:d01c:dc6:4402:61f3:ef98:4edd:cda4","2001:8a0:fe07:7800:bd1e:7fb5:db2:f993","TCP","86","443  >  49353 [ACK] Seq=7043 Ack=12103 Win=284 Len=0 TSval=3727859326 TSecr=937433096"
"133","5.778159","2a05:d01c:dc6:4402:61f3:ef98:4edd:cda4","2001:8a0:fe07:7800:bd1e:7fb5:db2:f993","TCP","86","443  >  49353 [ACK] Seq=7043 Ack=13531 Win=295 Len=0 TSval=3727859356 TSecr=937433122"
"134","5.778160","2a05:d01c:dc6:4402:61f3:ef98:4edd:cda4","2001:8a0:fe07:7800:bd1e:7fb5:db2:f993","TCP","86","443  >  49353 [ACK] Seq=7043 Ack=15406 Win=310 Len=0 TSval=3727859357 TSecr=937433122"
"135","5.780978","2a05:d01c:dc6:4402:61f3:ef98:4edd:cda4","2001:8a0:fe07:7800:bd1e:7fb5:db2:f993","TLSv1.2","329","Application Data"
"136","5.780982","192.168.1.79","132.145.26.73","STUN","146","Binding Request user: 2j9qv1f6u9pgf0:pPKX"
"137","5.781038","2001:8a0:fe07:7800:bd1e:7fb5:db2:f993","2a05:d01c:dc6:4402:61f3:ef98:4edd:cda4","TCP","86","49353  >  443 [ACK] Seq=15406 Ack=7286 Win=2044 Len=0 TSval=937433167 TSecr=3727859359"
"138","5.790937","192.168.1.79","76.223.9.91","TLSv1.2","433","Application Data"
"139","5.794739","192.168.1.79","76.223.9.91","TLSv1.2","409","Application Data"
"140","5.800041","76.223.9.91","192.168.1.79","TCP","66","443  >  49359 [ACK] Seq=1 Ack=25931 Win=1979 Len=0 TSval=81142280 TSecr=937433176"
"141","5.803937","2001:8a0:fe07:7800::1","2001:8a0:fe07:7800:bd1e:7fb5:db2:f993","DNS","198","Standard query response 0x9179 AAAA meet-jit-si-turnrelay.jitsi.net SOA ns-1595.awsdns-41.co.uk"
"142","5.803938","76.223.9.91","192.168.1.79","TCP","66","443  >  49359 [ACK] Seq=1 Ack=26274 Win=1979 Len=0 TSval=81142280 TSecr=937433179"
"143","5.803938","2001:8a0:fe07:7800::1","2001:8a0:fe07:7800:bd1e:7fb5:db2:f993","DNS","217","Standard query response 0x4529 AAAA meet-jit-si-eu-west-2a-s46-jvb-42-81-213.jitsi.net SOA ns-1595.awsdns-41.co.uk"
"144","5.804336","192.168.1.79","132.145.26.73","TCP","78","49360  >  443 [SYN, ECN, CWR] Seq=0 Win=65535 Len=0 MSS=1460 WS=64 TSval=937433187 TSecr=0 SACK_PERM=1"
"145","5.804459","192.168.1.79","193.123.60.145","STUN","62","Binding Request"
"146","5.804715","192.168.1.79","193.123.60.145","STUN","70","Allocate Request UDP"
"147","5.805077","2001:8a0:fe07:7800:bd1e:7fb5:db2:f993","2001:8a0:fe07:7800::1","DNS","111","Standard query 0xd2f6 A meet-jit-si-turnrelay.jitsi.net"
"148","5.805122","2001:8a0:fe07:7800:bd1e:7fb5:db2:f993","2001:8a0:fe07:7800::1","DNS","111","Standard query 0xb501 AAAA meet-jit-si-turnrelay.jitsi.net"
"149","5.811127","2001:8a0:fe07:7800::1","2001:8a0:fe07:7800:bd1e:7fb5:db2:f993","DNS","127","Standard query response 0xd2f6 A meet-jit-si-turnrelay.jitsi.net A 193.123.60.145"
"150","5.822853","2001:8a0:fe07:7800::1","2001:8a0:fe07:7800:bd1e:7fb5:db2:f993","DNS","198","Standard query response 0xb501 AAAA meet-jit-si-turnrelay.jitsi.net SOA ns-1595.awsdns-41.co.uk"
"151","5.823193","192.168.1.79","193.123.60.145","TCP","78","49361  >  443 [SYN, ECN, CWR] Seq=0 Win=65535 Len=0 MSS=1460 WS=64 TSval=937433206 TSecr=0 SACK_PERM=1"
"152","5.823350","192.168.1.79","193.123.60.145","TCP","78","49362  >  443 [SYN, ECN, CWR] Seq=0 Win=65535 Len=0 MSS=1460 WS=64 TSval=937433206 TSecr=0 SACK_PERM=1"
"153","5.825674","132.145.26.73","192.168.1.79","STUN","146","Binding Success Response XOR-MAPPED-ADDRESS: 188.250.85.250:55552 user: 2j9qv1f6u9pgf0:pPKX"
"154","5.826550","192.168.1.79","132.145.26.73","DTLSv1.2","201","Client Hello"
"155","5.826900","192.168.1.79","76.223.9.91","TLSv1.2","260","Application Data"
"156","5.829704","192.168.1.79","132.145.26.73","STUN","146","Binding Request user: 2j9qv1f6u9pgf0:pPKX"
"157","5.836810","76.223.9.91","192.168.1.79","TCP","66","443  >  49359 [ACK] Seq=1 Ack=26468 Win=1979 Len=0 TSval=81142283 TSecr=937433209"
"158","5.844143","132.145.26.73","192.168.1.79","STUN","154","Binding Request user: pPKX:2j9qv1f6u9pgf0"
"159","5.844527","192.168.1.79","132.145.26.73","STUN","106","Binding Success Response XOR-MAPPED-ADDRESS: 132.145.26.73:10000"
"160","5.846062","192.168.1.79","76.223.9.91","TCP","1514","49359  >  443 [ACK] Seq=26468 Ack=1 Win=2048 Len=1448 TSval=937433226 TSecr=81142283 [TCP segment of a reassembled PDU]"
"161","5.846067","192.168.1.79","76.223.9.91","TCP","1514","49359  >  443 [ACK] Seq=27916 Ack=1 Win=2048 Len=1448 TSval=937433226 TSecr=81142283 [TCP segment of a reassembled PDU]"
"162","5.846068","192.168.1.79","76.223.9.91","TCP","1514","49359  >  443 [ACK] Seq=29364 Ack=1 Win=2048 Len=1448 TSval=937433226 TSecr=81142283 [TCP segment of a reassembled PDU]"
"163","5.846070","192.168.1.79","76.223.9.91","TCP","1514","49359  >  443 [ACK] Seq=30812 Ack=1 Win=2048 Len=1448 TSval=937433226 TSecr=81142283 [TCP segment of a reassembled PDU]"
"164","5.846071","192.168.1.79","76.223.9.91","TLSv1.2","1464","Application Data"
"165","5.846996","192.168.1.79","76.223.9.91","TLSv1.2","258","Application Data"
"166","5.847030","132.145.26.73","192.168.1.79","TCP","74","443  >  49360 [SYN, ACK, ECN] Seq=0 Ack=1 Win=62636 Len=0 MSS=1460 SACK_PERM=1 TSval=2145719577 TSecr=937433187 WS=2048"
"167","5.847084","192.168.1.79","132.145.26.73","TCP","66","49360  >  443 [ACK] Seq=1 Ack=1 Win=131712 Len=0 TSval=937433227 TSecr=2145719577"
"168","5.847112","192.168.1.79","76.223.9.91","TLSv1.2","239","Application Data"
"169","5.847417","192.168.1.79","132.145.26.73","TLSv1.2","583","Client Hello"
"170","5.853917","193.123.60.145","192.168.1.79","STUN","142","Binding Success Response XOR-MAPPED-ADDRESS: 188.250.85.250:53774 MAPPED-ADDRESS: 188.250.85.250:53774 RESPONSE-ORIGIN: 193.123.60.145:443 OTHER-ADDRESS: 193.123.60.145:444"
"171","5.853917","193.123.60.145","192.168.1.79","STUN","154","Allocate Error Response error-code: 401 (Unauthorized) Unauthorized with nonce realm: coturn.jitsi.net"
"172","5.854481","192.168.1.79","193.123.60.145","STUN","150","Allocate Request UDP user: 1622453351 realm: coturn.jitsi.net with nonce"
"173","5.854886","192.168.1.79","76.223.9.91","TLSv1.2","432","Application Data"
"174","5.860017","76.223.9.91","192.168.1.79","TCP","66","443  >  49359 [ACK] Seq=1 Ack=29364 Win=1979 Len=0 TSval=81142286 TSecr=937433226"
"175","5.860018","76.223.9.91","192.168.1.79","TCP","66","443  >  49359 [ACK] Seq=1 Ack=32260 Win=1979 Len=0 TSval=81142286 TSecr=937433226"
"176","5.860018","76.223.9.91","192.168.1.79","TCP","66","443  >  49359 [ACK] Seq=1 Ack=33658 Win=1979 Len=0 TSval=81142286 TSecr=937433226"
"177","5.860019","76.223.9.91","192.168.1.79","TCP","66","443  >  49359 [ACK] Seq=1 Ack=34023 Win=1979 Len=0 TSval=81142286 TSecr=937433226"
"178","5.864072","76.223.9.91","192.168.1.79","TCP","66","443  >  49359 [ACK] Seq=1 Ack=34389 Win=1979 Len=0 TSval=81142286 TSecr=937433234"
"179","5.870201","193.123.60.145","192.168.1.79","TCP","74","443  >  49362 [SYN, ACK, ECN] Seq=0 Ack=1 Win=62636 Len=0 MSS=1460 SACK_PERM=1 TSval=3889249876 TSecr=937433206 WS=2048"
"180","5.870269","192.168.1.79","193.123.60.145","TCP","66","49362  >  443 [ACK] Seq=1 Ack=1 Win=131712 Len=0 TSval=937433248 TSecr=3889249876"
"181","5.870549","192.168.1.79","193.123.60.145","TLSv1.2","583","Client Hello"
"182","5.871315","2001:8a0:fe07:7800:bd1e:7fb5:db2:f993","2a05:d01c:dc6:4402:61f3:ef98:4edd:cda4","TCP","1514","49353  >  443 [ACK] Seq=15406 Ack=7286 Win=2048 Len=1428 TSval=937433249 TSecr=3727859359 [TCP segment of a reassembled PDU]"
"183","5.871318","2001:8a0:fe07:7800:bd1e:7fb5:db2:f993","2a05:d01c:dc6:4402:61f3:ef98:4edd:cda4","TLSv1.2","330","Application Data"
"184","5.872274","132.145.26.73","192.168.1.79","STUN","146","Binding Success Response XOR-MAPPED-ADDRESS: 188.250.85.250:55552 user: 2j9qv1f6u9pgf0:pPKX"
"185","5.875940","193.123.60.145","192.168.1.79","TCP","74","443  >  49361 [SYN, ACK, ECN] Seq=0 Ack=1 Win=62636 Len=0 MSS=1460 SACK_PERM=1 TSval=3889249876 TSecr=937433206 WS=2048"
"186","5.875941","2a05:d01c:dc6:4402:61f3:ef98:4edd:cda4","2001:8a0:fe07:7800:bd1e:7fb5:db2:f993","TLSv1.2","332","Application Data"
"187","5.876025","192.168.1.79","193.123.60.145","TCP","66","49361  >  443 [ACK] Seq=1 Ack=1 Win=131712 Len=0 TSval=937433253 TSecr=3889249876"
"188","5.876038","2001:8a0:fe07:7800:bd1e:7fb5:db2:f993","2a05:d01c:dc6:4402:61f3:ef98:4edd:cda4","TCP","86","49353  >  443 [ACK] Seq=17078 Ack=7532 Win=2044 Len=0 TSval=937433253 TSecr=3727859454"
"189","5.876277","192.168.1.79","193.123.60.145","TLSv1.2","583","Client Hello"
"190","5.879164","192.168.1.79","132.145.26.73","STUN","146","Binding Request user: 2j9qv1f6u9pgf0:pPKX"
"191","5.883323","132.145.26.73","192.168.1.79","STUN","154","Binding Request user: pPKX:2j9qv1f6u9pgf0"
"192","5.883600","192.168.1.79","132.145.26.73","STUN","106","Binding Success Response XOR-MAPPED-ADDRESS: 132.145.26.73:10000"
"193","5.884601","2001:8a0:fe07:7800:bd1e:7fb5:db2:f993","2a05:d01c:dc6:4402:61f3:ef98:4edd:cda4","TLSv1.2","1140","Application Data"
"194","5.889125","2001:8a0:fe07:7800:bd1e:7fb5:db2:f993","2a05:d01c:dc6:4402:61f3:ef98:4edd:cda4","TLSv1.2","147","Application Data"
"195","5.895662","132.145.26.73","192.168.1.79","TCP","66","443  >  49360 [ACK] Seq=1 Ack=518 Win=63488 Len=0 TSval=2145719623 TSecr=937433227"
"196","5.897222","132.145.26.73","192.168.1.79","TCP","1514","443  >  49360 [ACK] Seq=1 Ack=518 Win=63488 Len=1448 TSval=2145719628 TSecr=937433227 [TCP segment of a reassembled PDU]"
"197","5.897279","192.168.1.79","132.145.26.73","TCP","66","49360  >  443 [ACK] Seq=518 Ack=1449 Win=130304 Len=0 TSval=937433272 TSecr=2145719628"
"198","5.899080","132.145.26.73","192.168.1.79","TCP","1514","443  >  49360 [PSH, ACK] Seq=1449 Ack=518 Win=63488 Len=1448 TSval=2145719628 TSecr=937433227 [TCP segment of a reassembled PDU]"
"199","5.899080","132.145.26.73","192.168.1.79","TLSv1.2","447","Server Hello, Certificate, Server Key Exchange, Server Hello Done"
"200","5.899143","192.168.1.79","132.145.26.73","TCP","66","49360  >  443 [ACK] Seq=518 Ack=3278 Win=129216 Len=0 TSval=937433273 TSecr=2145719628"
"201","5.902879","132.145.26.73","192.168.1.79","STUN","158","Binding Request user: pPKX:2j9qv1f6u9pgf0"
"202","5.903217","192.168.1.79","132.145.26.73","STUN","106","Binding Success Response XOR-MAPPED-ADDRESS: 132.145.26.73:10000"
"203","5.905094","192.168.1.79","132.145.26.73","TLSv1.2","159","Client Key Exchange, Change Cipher Spec, Encrypted Handshake Message"
"204","5.905879","193.123.60.145","192.168.1.79","STUN","150","Allocate Success Response XOR-RELAYED-ADDRESS: 193.123.60.145:58447 XOR-MAPPED-ADDRESS: 188.250.85.250:53774 lifetime: 600"
"205","5.906694","192.168.1.79","76.223.9.91","TLSv1.2","432","Application Data"
"206","5.915429","193.123.60.145","192.168.1.79","TCP","66","443  >  49362 [ACK] Seq=1 Ack=518 Win=63488 Len=0 TSval=3889249921 TSecr=937433248"
"207","5.916341","192.168.1.79","132.145.26.73","DTLSv1.2","201","Client Hello"
"208","5.916419","193.123.60.145","192.168.1.79","TLSv1.2","1514","Server Hello"
"209","5.916460","192.168.1.79","193.123.60.145","TCP","66","49362  >  443 [ACK] Seq=518 Ack=1449 Win=130304 Len=0 TSval=937433287 TSecr=3889249922"
"210","5.917121","193.123.60.145","192.168.1.79","TCP","1514","443  >  49362 [ACK] Seq=1449 Ack=518 Win=63488 Len=1448 TSval=3889249922 TSecr=937433248 [TCP segment of a reassembled PDU]"
"211","5.917122","193.123.60.145","192.168.1.79","TLSv1.2","438","Certificate, Server Key Exchange, Server Hello Done"
"212","5.917122","2a05:d01c:dc6:4402:61f3:ef98:4edd:cda4","2001:8a0:fe07:7800:bd1e:7fb5:db2:f993","TCP","86","443  >  49353 [ACK] Seq=7532 Ack=17078 Win=323 Len=0 TSval=3727859495 TSecr=937433249"
"213","5.917123","76.223.9.91","192.168.1.79","TCP","66","443  >  49359 [ACK] Seq=1 Ack=34755 Win=1979 Len=0 TSval=81142292 TSecr=937433279"
"214","5.917166","192.168.1.79","193.123.60.145","TCP","66","49362  >  443 [ACK] Seq=518 Ack=3269 Win=129216 Len=0 TSval=937433288 TSecr=3889249922"
"215","5.920746","132.145.26.73","192.168.1.79","STUN","146","Binding Success Response XOR-MAPPED-ADDRESS: 188.250.85.250:55552 user: 2j9qv1f6u9pgf0:pPKX"
"216","5.924390","192.168.1.79","193.123.60.145","TLSv1.2","159","Client Key Exchange, Change Cipher Spec, Encrypted Handshake Message"
"217","5.927470","193.123.60.145","192.168.1.79","TCP","66","443  >  49361 [ACK] Seq=1 Ack=518 Win=63488 Len=0 TSval=3889249928 TSecr=937433253"
"218","5.927613","193.123.60.145","192.168.1.79","TLSv1.2","1514","Server Hello"
"219","5.927673","192.168.1.79","193.123.60.145","TCP","66","49361  >  443 [ACK] Seq=518 Ack=1449 Win=130304 Len=0 TSval=937433298 TSecr=3889249929"
"220","5.928385","193.123.60.145","192.168.1.79","TCP","1514","443  >  49361 [ACK] Seq=1449 Ack=518 Win=63488 Len=1448 TSval=3889249929 TSecr=937433253 [TCP segment of a reassembled PDU]"
"221","5.928387","193.123.60.145","192.168.1.79","TLSv1.2","438","Certificate, Server Key Exchange, Server Hello Done"
"222","5.928436","192.168.1.79","193.123.60.145","TCP","66","49361  >  443 [ACK] Seq=518 Ack=3269 Win=129216 Len=0 TSval=937433298 TSecr=3889249929"
"223","5.928449","192.168.1.79","10.42.81.213","STUN","146","Binding Request user: 2j9qv1f6u9pgf0:pPKX"
"224","5.928993","192.168.1.79","193.123.60.145","TLSv1.2","159","Client Key Exchange, Change Cipher Spec, Encrypted Handshake Message"
"225","5.933612","2a05:d01c:dc6:4402:61f3:ef98:4edd:cda4","2001:8a0:fe07:7800:bd1e:7fb5:db2:f993","TLSv1.2","357","Application Data"
"226","5.933667","2001:8a0:fe07:7800:bd1e:7fb5:db2:f993","2a05:d01c:dc6:4402:61f3:ef98:4edd:cda4","TCP","86","49353  >  443 [ACK] Seq=18193 Ack=7803 Win=2043 Len=0 TSval=937433304 TSecr=3727859511"
"227","5.934879","2001:8a0:fe07:7800:bd1e:7fb5:db2:f993","2a05:d01c:dc6:4402:61f3:ef98:4edd:cda4","TLSv1.2","154","Application Data"
"228","5.936242","2a05:d01c:dc6:4402:61f3:ef98:4edd:cda4","2001:8a0:fe07:7800:bd1e:7fb5:db2:f993","TLSv1.2","150","Application Data"
"229","5.936288","2001:8a0:fe07:7800:bd1e:7fb5:db2:f993","2a05:d01c:dc6:4402:61f3:ef98:4edd:cda4","TCP","86","49353  >  443 [ACK] Seq=18261 Ack=7867 Win=2047 Len=0 TSval=937433306 TSecr=3727859515"
"230","5.948466","132.145.26.73","192.168.1.79","STUN","158","Binding Request user: pPKX:2j9qv1f6u9pgf0"
"231","5.948468","132.145.26.73","192.168.1.79","TCP","66","443  >  49360 [ACK] Seq=3278 Ack=611 Win=63488 Len=0 TSval=2145719677 TSecr=937433278"
"232","5.948468","132.145.26.73","192.168.1.79","DTLSv1.2","131","Server Hello"
"233","5.948469","132.145.26.73","192.168.1.79","DTLSv1.2","401","Certificate"
"234","5.948807","192.168.1.79","132.145.26.73","STUN","106","Binding Success Response XOR-MAPPED-ADDRESS: 132.145.26.73:10000"
"235","5.950669","132.145.26.73","192.168.1.79","DTLSv1.2","177","Server Key Exchange"
"236","5.950670","132.145.26.73","192.168.1.79","DTLSv1.2","77","Certificate Request"
"237","5.950670","132.145.26.73","192.168.1.79","DTLSv1.2","67","Server Hello Done"
"238","5.950671","132.145.26.73","192.168.1.79","TLSv1.2","72","Change Cipher Spec"
"239","5.950671","132.145.26.73","192.168.1.79","TLSv1.2","111","Encrypted Handshake Message"
"240","5.950725","192.168.1.79","132.145.26.73","TCP","66","49360  >  443 [ACK] Seq=611 Ack=3329 Win=131008 Len=0 TSval=937433320 TSecr=2145719682"
"241","5.951017","192.168.1.79","132.145.26.73","TLSv1.2","728","Application Data"
"242","5.951469","192.168.1.79","132.145.26.73","DTLSv1.2","586","Certificate, Client Key Exchange, Certificate Verify, Change Cipher Spec, Encrypted Handshake Message"
"243","5.959707","132.145.26.73","192.168.1.79","DTLSv1.2","131","Server Hello"
"244","5.959708","132.145.26.73","192.168.1.79","DTLSv1.2","401","Certificate"
"245","5.959709","132.145.26.73","192.168.1.79","DTLSv1.2","177","Server Key Exchange"
"246","5.959709","132.145.26.73","192.168.1.79","DTLSv1.2","77","Certificate Request"
"247","5.959710","132.145.26.73","192.168.1.79","DTLSv1.2","67","Server Hello Done"
"248","5.967138","193.123.60.145","192.168.1.79","TLSv1.2","292","New Session Ticket, Change Cipher Spec, Encrypted Handshake Message"
"249","5.967201","192.168.1.79","193.123.60.145","TCP","66","49362  >  443 [ACK] Seq=611 Ack=3495 Win=130816 Len=0 TSval=937433336 TSecr=3889249974"
"250","5.967636","192.168.1.79","193.123.60.145","TLSv1.2","123","Application Data"
"251","5.977274","193.123.60.145","192.168.1.79","TLSv1.2","292","New Session Ticket, Change Cipher Spec, Encrypted Handshake Message"
"252","5.977301","192.168.1.79","10.42.81.213","STUN","146","Binding Request user: 2j9qv1f6u9pgf0:pPKX"
"253","5.977317","192.168.1.79","193.123.60.145","TCP","66","49361  >  443 [ACK] Seq=611 Ack=3495 Win=130816 Len=0 TSval=937433346 TSecr=3889249979"
"254","5.977549","192.168.1.79","193.123.60.145","TLSv1.2","123","Application Data"
"255","5.991123","132.145.26.73","192.168.1.79","TCP","66","443  >  49360 [ACK] Seq=3329 Ack=1273 Win=63488 Len=0 TSval=2145719722 TSecr=937433320"
"256","5.991814","132.145.26.73","192.168.1.79","TLSv1.2","340","Application Data"
"257","5.991815","132.145.26.73","192.168.1.79","TLSv1.2","157","Application Data"
"258","5.991868","192.168.1.79","132.145.26.73","TCP","66","49360  >  443 [ACK] Seq=1273 Ack=3694 Win=130688 Len=0 TSval=937433359 TSecr=2145719723"
"259","5.992388","132.145.26.73","192.168.1.79","TLSv1.2","179","Application Data"
"260","5.992416","192.168.1.79","132.145.26.73","TCP","66","49360  >  443 [ACK] Seq=1273 Ack=3807 Win=130944 Len=0 TSval=937433360 TSecr=2145719723"
"261","5.994337","132.145.26.73","192.168.1.79","DTLSv1.2","60","Change Cipher Spec"
"262","5.994337","132.145.26.73","192.168.1.79","DTLSv1.2","103","Encrypted Handshake Message"
"263","5.996565","192.168.1.79","132.145.26.73","TLSv1.2","239","Application Data"
"264","5.996676","192.168.1.79","132.145.26.73","TLSv1.2","134","Application Data"
"265","6.000100","PtInovac_35:65:2f","Spanning-tree-(for-bridges)_00","STP","60","Conf. Root = 32768/0/00:06:91:35:65:2f  Cost = 0  Port = 0x8001"
"266","6.002261","2001:8a0:fe07:7800:bd1e:7fb5:db2:f993","2a05:d01c:dc6:4402:61f3:ef98:4edd:cda4","TLSv1.2","293","Application Data"
"267","6.002326","192.168.1.79","76.223.9.91","TLSv1.2","257","Application Data"
"268","6.010620","193.123.60.145","192.168.1.79","TLSv1.2","207","Application Data"
"269","6.010681","192.168.1.79","193.123.60.145","TCP","66","49362  >  443 [ACK] Seq=668 Ack=3636 Win=130880 Len=0 TSval=937433376 TSecr=3889250017"
"270","6.011012","192.168.1.79","193.123.60.145","TLSv1.2","203","Application Data"
"271","6.012178","192.168.1.79","132.145.26.73","UDP","131","55552  >  10000 Len=89"
"272","6.013225","76.223.9.91","192.168.1.79","TCP","66","443  >  49359 [ACK] Seq=1 Ack=34946 Win=1979 Len=0 TSval=81142301 TSecr=937433368"
"273","6.024066","2a05:d01c:dc6:4402:61f3:ef98:4edd:cda4","2001:8a0:fe07:7800:bd1e:7fb5:db2:f993","TCP","86","443  >  49353 [ACK] Seq=7867 Ack=18261 Win=334 Len=0 TSval=3727859603 TSecr=937433305"
"274","6.026971","193.123.60.145","192.168.1.79","TLSv1.2","207","Application Data"
"275","6.027026","192.168.1.79","193.123.60.145","TCP","66","49361  >  443 [ACK] Seq=668 Ack=3636 Win=130880 Len=0 TSval=937433390 TSecr=3889250029"
"276","6.027320","192.168.1.79","193.123.60.145","TLSv1.2","203","Application Data"
"277","6.031049","192.168.1.79","132.145.26.73","UDP","128","55552  >  10000 Len=86"
"278","6.039074","132.145.26.73","192.168.1.79","TCP","66","443  >  49360 [ACK] Seq=3807 Ack=1514 Win=63488 Len=0 TSval=2145719769 TSecr=937433363"
"279","6.047427","2a05:d01c:dc6:4402:61f3:ef98:4edd:cda4","2001:8a0:fe07:7800:bd1e:7fb5:db2:f993","TCP","86","443  >  49353 [ACK] Seq=7867 Ack=18468 Win=345 Len=0 TSval=3727859626 TSecr=937433368"
"280","6.051344","192.168.1.79","132.145.26.73","UDP","124","55552  >  10000 Len=82"
"281","6.060684","193.123.60.145","192.168.1.79","TLSv1.2","203","Application Data"
"282","6.060685","132.145.26.73","192.168.1.79","TLSv1.2","102","Application Data"
"283","6.060775","192.168.1.79","132.145.26.73","TCP","66","49360  >  443 [ACK] Seq=1514 Ack=3843 Win=131008 Len=0 TSval=937433423 TSecr=2145719788"
"284","6.060802","192.168.1.79","193.123.60.145","TCP","66","49362  >  443 [ACK] Seq=805 Ack=3773 Win=130880 Len=0 TSval=937433423 TSecr=3889250060"
"285","6.062831","2001:8a0:fe07:7800:bd1e:7fb5:db2:f993","2a05:d01c:dc6:4402:61f3:ef98:4edd:cda4","TLSv1.2","993","Application Data"
"286","6.071348","192.168.1.79","132.145.26.73","UDP","124","55552  >  10000 Len=82"
"287","6.076257","193.123.60.145","192.168.1.79","TLSv1.2","203","Application Data"
"288","6.076316","192.168.1.79","193.123.60.145","TCP","66","49361  >  443 [ACK] Seq=805 Ack=3773 Win=130880 Len=0 TSval=937433438 TSecr=3889250078"
"289","6.077068","192.168.1.79","76.223.9.91","TLSv1.2","431","Application Data"
"290","6.079587","192.168.1.79","76.223.9.91","TLSv1.2","258","Application Data"
"291","6.079653","192.168.1.79","76.223.9.91","TLSv1.2","239","Application Data"
"292","6.086031","76.223.9.91","192.168.1.79","TCP","66","443  >  49359 [ACK] Seq=1 Ack=35311 Win=1979 Len=0 TSval=81142308 TSecr=937433438"
"293","6.089121","76.223.9.91","192.168.1.79","TCP","66","443  >  49359 [ACK] Seq=1 Ack=35503 Win=1979 Len=0 TSval=81142309 TSecr=937433441"
